Bank Name,Financial Text,Financial Term
Siemens Bank 2022,While negative recovery fluctuations lead to higher loss in the  event of rating migration asset recovery fluctuations lead to  direct loss in market value,LOSS
Siemens Bank 2022,For customers with specific loan  loss provisions the exposure is reduced by the value of the  specific loan loss provision,LOSS
Siemens Bank 2022,The credit value at risk and the  risk contributions for the risk units are then derived from the  loss distribution,LOSS
Siemens Bank 2022,In addition to the credit value at risk the  risk contributions from the largest portfolios and segments  are also calculated in order to measure concentration risk,CREDIT
Siemens Bank 2022,Country risk Country risk is measured by analyzing concentration risk for  individual countries in terms of economic capital require- ment and credit exposure,CREDIT
Siemens Bank 2022,Country risk is limited both by  preventive action in which exposure limits must be adhered  to during the course of the credit process and by the ongoing  analysis of concentration risk in individual countries,CREDIT
Siemens Bank 2022,Backtesting Siemens Bank carries out monthly backtesting of the risk clas- sification and probabilities of default as well as an analysis  of rating migrations in order to ensure and refine the level  of quality in its modeling of expected and unexpected loss  credit value at risk,LOSS
Siemens Bank 2022,Pricing As part of the credit process new business is assessed using  measurement methods and pricing tools,CREDIT
Siemens Bank 2022,These methods and  tools factor in funding costs expected losses and tax effects  as well as administration expenses and the costs in connec- tion with economic risk capital,LOSS
Siemens Bank 2022,Early detection of risk The credit rating process at Siemens Bank is based on estab- lished reporting and monitoring processes ensuring that  credit ratings are up to date,CREDIT
Siemens Bank 2022,Qualitative and quantitative  information is regularly monitored classified and promptly  included in any credit rating assessment,CREDIT
Siemens Bank 2022,The stress tests and sensitivity analyses for  credit risk are carried out regularly for the overall risk report- ing as well as ad hoc,CREDIT
Siemens Bank 2022,Stress tests  on the other hand provide a holistic view for the purpos- es of assessing credit risk,CREDIT
Siemens Bank 2022,The bor - rowers credit rating itself is determined independently of any  individual transactions and as a result also independently  of available collateral,CREDIT
Siemens Bank 2022,Types of collateral In its management of credit risk Siemens Bank makes a   distinction between two fundamental categories of collateral  The first category comprises assets in the form of financial  or other collateral that the Bank can realize in the event of  a default thereby allowing the Bank to limit the incurred  loss,LOSS
Siemens Bank 2022,This category includes in particular physical assets in  the case of capital investment loans or project finance as  well as cash collateral,INVESTMENT
Siemens Bank 2022,The second category comprises collateral in the form of  guarantees furnished not by the borrower but by indepen- dent third parties for example government export credit  insurance,CREDIT
Siemens Bank 2022,Collateral management Both categories of collateral form an integral part of credit  risk management at Siemens Bank provided that such col- lateral meets internal requirements for collateral that can be  accepted by the Bank,CREDIT
Siemens Bank 2022,Specifically collateral in the second  category is only acceptable if the credit rating of the guar - antor is better than the rating of the original borrower the  guarantee is directly legally enforceable all documentary  requirements are met and the guarantor is not an individual,CREDIT
Siemens Bank 2022,Collateral in the first category results in a reduction in the  expected and in the unexpected loss because the recovery  rate for the transaction has been increased or because an  asset recovery is recognized,LOSS
Siemens Bank 2022,Collateral in the second catego- ry also leads to a reduction in the expected and unexpected  loss in that the credit rating of the guarantor is also factored  into the calculation,LOSS
Siemens Bank 2022,These  allowances are intended to cover the expected loss after tak - ing into account any expected proceeds from the realized col- lateral,LOSS
Siemens Bank 2022,Siemens Bank also recognizes general loan loss provi- sions to cover the latent credit risk in the portfolio of loans  and advances,LOSS
Siemens Bank 2022,In doing so loan loss provision rates based on  the rating the expected term and the internal estimate of  loss ratios in the event of loss are applied to the unsecured  exposure,LOSS
Siemens Bank 2022,The rating also factors in an assessment of country  risk with the result that any general loan loss provision rec- ognized by the Bank also covers the assumed latent country  risk,LOSS
Siemens Bank 2022,As of September 30 2022 Siemens Bank had total recog- nized specific and general loan loss provisions of 161,LOSS
Siemens Bank 2022,Specific loan loss provi- sions include transaction-specific assessments of future cash  flows probabilities of default and expected loss rates tak - ing into account collateral and where applicable restructur - ing effects,LOSS
Siemens Bank 2022,This effect dominates  the item allowances for losses on loans and advances and  is primarily responsible for the increase compared to previ- ous years,LOSS
Siemens Bank 2022,The provisions for latent credit risks increased only  slightly as significant additions were already made in the  previous fiscal year,CREDIT
Siemens Bank 2022,The amount of capital required is largely determined by the  lending portfolio volume borrower credit ratings collater - alization and borrower industrial sectors and countries,CREDIT
Siemens Bank 2022,The  year-on-year increase in required risk capital is mainly due to  increased credit exposure and the deteriorating credit envi- ronment in the second half of the year,CREDIT
Siemens Bank 2022,As of September 30 2022 the lending portfolio from lending  business and the Treasurys investments as part of liquidity  risk management and asset liability management excluding  short-term money market investments and treasury bills had  a nominal value of 8179,LIABILITY
Siemens Bank 2022,A breakdown of the Siemens Bank lending portfolio by credit  rating as of September 30 2022 is shown in the following  table,CREDIT
Siemens Bank 2022,million 2022 2021 Rating category Out- standingOut - standing Investment grade 2593,INVESTMENT
Siemens Bank 2022,Non-collateralized loans are in general only granted  to customers with an investment-grade rating,INVESTMENT
Siemens Bank 2022,These exposures  at risk of default and defaulted exposures are already covered  to a significant extent by specific loan loss provisions,LOSS
Siemens Bank 2022,The framework of rules and regulations for identifying man- aging and monitoring liquidity and market risk comprises the  Asset Liability Management Policy ALM Policy and its associ- ated guidelines,LIABILITY
Siemens Bank 2022,Funding risk Funding risk is the risk that Siemens Bank will only be able  to close gaps in its liquidity gap profile by obtaining funds at  increased market interest rates,INTEREST
Siemens Bank 2022,The maximum present value  loss arising from changes in funding terms and conditions is  calculated daily in the form of liquidity value at risk LVaR  based on the net cash flows determined in a spread-sensitive  liquidity gap profile,LOSS
Siemens Bank 2022,Siemens Bank  takes on funding positions that result in liquidity risk only  within the framework of its asset-liability management,LIABILITY
Siemens Bank 2022,These option- al and modeled cash flows include for example outstand- ing project finance drawings committed but undrawn lines  of credit the notified lending and deposit business possible  drawings from the guarantee exposure as well as possible  and imminent losses in the lending portfolio,LOSS
Siemens Bank 2022,Siemens Bank  maintains a liquidity buffer of assets eligible as collateral  with central banks deposits with central banks and other  high-quality liquid assets,DEPOSIT
Siemens Bank 2022,Within strict limits deposits are also used for funding the  lending business,DEPOSIT
Siemens Bank 2022,Currently market risk at Siemens Bank  comprises interest-rate risk and currency risk,INTEREST
Siemens Bank 2022,Market liquidity risk is managed in an integrated approach  in conjunction with the management of market risk because  Siemens Bank is only exposed to market liquidity risk as a  result of ordinary interest-rate and currency derivatives that it  enters into to reduce the risk arising from open risk positions,INTEREST
Siemens Bank 2022,Siemens Bank takes on  market risk positions solely in the context of its asset-liability  management,LIABILITY
Siemens Bank 2022,In addition to measuring present value market risk Siemens   Bank also calculates a monthly value-at-risk to measure net  interest income NII in accordance with the European Bank - ing Authority EBA guidelines for managing interest rate risk  in the banking book IRRBB,INTEREST
Siemens Bank 2022,The  main part of this originates from the changes in the interest  rate market and the increased interest rates in EUR GBP and  USD,INTEREST
Siemens Bank 2022,Any losses actually incurred above a defined threshold value  are recorded without delay in the Banks own database of  losses and analyzed to establish the cause of the losses,LOSS
Siemens Bank 2022,Siemens Bank uses the basic indicator approach BIA as spec- ified in CRR II in order to measure and cover the regulatory  capital requirement for operational risk,REGULATORY
Siemens Bank 2022,To measure the required economic capital Siemens Bank  compares the amount determined for regulatory purposes  under the BIA with the available risk-taking potential,REGULATORY
Siemens Bank 2022,Ad hoc reports are also used to report any material losses to  the Management Board without delay,LOSS
Siemens Bank 2022,These reports include  any reputational damage or losses due to fraud,LOSS
Siemens Bank 2022,The change was mainly due  to higher interest-rate and FX volatilities in particular for the  USD and GBP yield curves and the EURGBP exchange rate,INTEREST
Siemens Bank 2022,In this context the Siemens Bank  Credit Policy defines Sustainability Risks as environmental  social or governance events or conditions which if they  occur have or may potentially have significant negative  impact on Obligors or transactions and insofar on credit  risk or transaction risk or on reputation of the Bank,CREDIT
Siemens Bank 2022,by maintaining a strong  presence in Renewable Energy and Rolling Stock Finance  by making inroads into further areas of clean technologies  in the field of E-Mobility,STOCK
Siemens Bank 2022,Diversity Equity and Inclusion Siemens Bank believes  that a diverse and inclusive corporate culture has a posi- tive effect on its attractiveness as an employer and there- fore indirectly on its competitiveness,EQUITY
Siemens Bank 2022,An extremely important factor in Siemens Banks business  performance was the re-confirmation of its credit rating by  Moodys credit rating agency in September 2022,CREDIT
Siemens Bank 2022,In its credit  opinion Moodys affirmed an unchanged long-term rating  for Siemens Bank of A1 and an unchanged short-term rating  of P-1,CREDIT
Siemens Bank 2022,dollar and increased interest rates are narrowing the  scope for financing,INTEREST
Siemens Bank 2022,Lower business and consumer sentiment indica- tors high prices for some energy products and shrinking real  disposable incomes of households have a negative impact on  business investment and private consumption,INVESTMENT
Siemens Bank 2022,Further interest rate increases by central  banks are expected worldwide in order to permanently con- tain inflationary pressures,INTEREST
Siemens Bank 2022,In the United States key interest  rates may rise to 5 next year,INTEREST
Siemens Bank 2022,Due to the staggered impact  of monetary policy on the real economy this increase carries  the risk that adjustment may be too rapid and interest rate  levels may be too high possibly triggering a further econom- ic downturn with negative effects on the global economy,INTEREST
Siemens Bank 2022,Siemens Bank believes that the demand for project finance  and investment loans will remain on a level that is similar to  that of the previous years as the planning cycles for infra- structure projects and project financing are usually longer,INVESTMENT
Siemens Bank 2022,Here as in the past the Bank intends to avoid expo- sure to excessive credit risk through a diversification with  regard to regions and industries and through consistent risk  management,CREDIT
Siemens Bank 2022,Such a scenario would have a signifi- cant impact on the growth and profitability of companies and  may lead to credit defaults in the overall market from which  Siemens Bank would not be able to disengage itself,PROFIT
Siemens Bank 2022,In Europe the consequences of  the United Kingdoms exit from the EU restrictions due to  the disruption of supply chains and a rapidly rising trend in  energy and electricity prices can be observed,RESTRICTIONS
Siemens Bank 2022,While Siemens Bank limits political risks  primarily through credit insurance potential economic risks  are managed through strict credit risk management,CREDIT
Siemens Bank 2022,Economic  problems among borrowers may have a negative impact on  allowances for losses on loans and advances and may lead to  defaults in the lending portfolio,LOSS
Siemens Bank 2022,Business performance of Siemens Bank in   fiscal 2023 After a 2022 fiscal year which despite the effects of the  Ukraine conflict was successful overall Siemens Bank  expects its lending portfolio to continue to grow moderately  in the 2023 fiscal year whereby profitability will be impacted  significantly by the further macroeconomic developments,PROFIT
Siemens Bank 2022,For the coming 2023 fiscal year Siemens Bank expects the  liquidity investments included in loans and advances to banks  and customers to remain on a similar level while invest- ments with central banks and associated with this the short- term deposits of Siemens AG and its subsidiaries will tend to  decline to the level of the previous years,INVESTMENT
Siemens Bank 2022,However Siemens   Bank believes that the development in loans and advances to  customers in the lending business will have stronger impact  on business volume and net interest income,INTEREST
Siemens Bank 2022,Here Siemens   Bank expects continued moderate growth and higher inter - est margins in the 2023 fiscal year and associated with this  a corresponding development in the growth of net interest  income,INTEREST
Siemens Bank 2022,In addition Siemens   Bank will actively expand the new business segment Extend- ed Payment Terms and generate additional interest income  through this although the contribution to the balance  sheet and interest income will still be very low  of minor  32 Siemens Bank   Annual Report  2022 translation of the German originalimportance in the 2023 fiscal year,INTEREST
Siemens Bank 2022,Overall  Siemens Bank expects net interest income to grow slightly in  the 2023 fiscal year,INTEREST
Siemens Bank 2022,General administration expenses relate firstly to the core  lending business and the deposit and treasury business and  thus to banking business in the narrower sense of the term,DEPOSIT
Siemens Bank 2022,Thus this part of general administra- tion expenses is expected to essentially grow only as a result  of general price developments which are however higher  than in previous years due to higher inflation and increased  salary expectations adjustment of the resource base to the  increased business volume as well as investments in new  products,INVESTMENT
Siemens Bank 2022,Even though Siemens Bank will continue to only selectively  enter into credit risk and does not intend to compensate for  the continuing margin pressure in parts of the markets by  assuming excessive risks the Bank expects that due to the  current geopolitical and macroeconomic challenges allow - ances for losses on loans and advances in the coming fiscal  year will be above the normalized level of previous years   i,LOSS
Siemens Bank 2022,Continued strong net interest   income should compensate for the increase in general  administration expenses and necessary allocations to allow - ances for losses on loans and advances to the extent that  a significant improvement in income will be achieved  approaching the income level of the previous years,LOSS
Siemens Bank 2022,With regard to both performance indicators  net  operating income before tax and RORAC  the greatest uncer - tainty lies in the development of loan loss provisions and the  further development of geopolitical and macroeconomic risk  factors,LOSS
Siemens Bank 2022,Loans and advances to banks and customers Loans and advances to banks and customers are carried at their principal amount or at cost  whereby any difference between the amount paid out and the principal amount is recognized  as prepaid expenses or deferred income and reclassified to the income statement pro rata  temporis provided that such a difference has the nature of interest,INTEREST
Siemens Bank 2022,Notes to the financial  statements of Siemens Bank GmbH Munich for the fiscal year from  October 1 2021 to September 30 2022  40 Siemens Bank   Annual Report  2022 translation of the German originalPursuant to section 11 RechKredV interest receivables in connection with loans and advances  to banks and customers are reported under loans and advances to banks and customers but  are not included in the maturity structure tables of assets and liabilities,INTEREST
Siemens Bank 2022,The risk allowances for losses in the lending business include both specific loan loss provisions  and general loan loss provisions related to latent credit risks,LOSS
Siemens Bank 2022,Specific loan loss provisions con- tinue to reflect individual loan defaults expected in connection with a loan exposure at risk of  default,LOSS
Siemens Bank 2022,General loan loss provisions are based on borrower credit ratings residual maturities  and rating-related probability of default and the proportion of loss in the event of a default,LOSS
Siemens Bank 2022,Bonds and other fixed-income securities The securities recognized under this line item are classified as current assets and are mea- sured strictly at the lower amount of cost and fair value,BONDS
Siemens Bank 2022,Interest receivables from bonds and  other fixed-income securities are recognized under bonds and other fixed-income securities  in accordance with section 11 RechKredV,INTEREST
Siemens Bank 2022,Pursuant to  section 11 RechKredV interest obligations in connection with amounts due to banks or cus- tomers are reported under amounts due to banks or customers but are not included in the  maturity structure tables of assets and liabilities,INTEREST
Siemens Bank 2022,Annual financial statements Notes to the financial statements Basis of accounting in the annual financial statements of  Siemens Bank Accounting policies 41 Annual Report 2022  Siemens Bank  Deferred taxes On any differences between the valuation of assets debts and prepaid expenses or deferred  income under trade law provisions and under tax law provisions respectively taking into con- sideration deductible losses and interest carried forward a surplus of deferred tax liabilities is  recognized if it is to be assumed that there will be a tax burden overall in future fiscal years,LOSS
Siemens Bank 2022,Provisions for pensions Payment obligations from pension commitments are measured on the basis of biometric   probabilities at the settlement amount determined using the actuarial projected unit credit  method,CREDIT
Siemens Bank 2022,In order to determine the interest rate for the discounting of the provisions as of   September 30 2022 Siemens Bank as in previous years uses a ten-year average,INTEREST
Siemens Bank 2022,Based on  the existing profit-and-loss transfer agreement with Siemens AG income from this adjust- ment is not subject to the dividend payout restriction,PROFIT
Siemens Bank 2022,Netting of assets and liabilities income and expense Assets whose sole purpose is to satisfy pension obligations or residual partial retirement   obligations and that cannot be the subject of a claim by any other creditors are measured  at fair value,CREDIT
Siemens Bank 2022,Income and expenses associated with these assets are netted with the interest  cost in connection with the unwinding of discounts on the corresponding obligations and are  reported under general administration expenses social security post-employment and other  employee benefit costs and under other operating expenses,INTEREST
Siemens Bank 2022,Provisions include individual appropriate and adequate provisions for  all identifiable risks arising in connection with contingent liabilities and for imminent losses  arising from pending transactions taking into account estimated future increases in prices  and costs,LOSS
Siemens Bank 2022,Interest income and interest expense in connection with discounting  and unwinding the discount on provisions are reported under other operating income and  expense because they are unrelated to banking operations,INTEREST
Siemens Bank 2022,For all interest rate-related financial instruments in the banking book Siemens Bank provides  evidence  in accordance with the principle of loss-free valuation  that no losses will be  incurred in the future from contracted interest rate positions,LOSS
Siemens Bank 2022,This is done by comparing the  net present value of the banking book with its net carrying amount taking into consideration  expected losses and present value general administration expenses from the resolution of the  42 Siemens Bank   Annual Report  2022 translation of the German originalexisting portfolio,LOSS
Siemens Bank 2022,Assets denominated in foreign currency are documented as specifically covered if they are  matched by a countervailing liability or derivative in the currency concerned,LIABILITY
Siemens Bank 2022,Any currency trans- lation gain or loss is reported under other operating income or expense,LOSS
Siemens Bank 2022,Embedded floors result from minimum limits for interest  agreed in loan agreements with variable interest rates,INTEREST
Siemens Bank 2022,Short-term  interest-rate-related transactions are measured and recognized using the imparity principle  because no designation to accounting groups Bewertungseinheiten as defined by the HGB  can be demonstrated,INTEREST
Siemens Bank 2022,For loan terms of one year or more interest-related hedging deals are  incorporated on a regular basis into HGB accounting groups,INTEREST
Siemens Bank 2022,Annual financial statements Notes to the financial statements Accounting policies 43 Annual Report 2022  Siemens Bank  Income statement disclosures 1 Geographical breakdown and net interest income The breakdown of the total amount of net interest income fee and commission income and  other operating income by customers based in Germany and by customers based elsewhere is  as follows in  2022 2021 Germany 12 11 Elsewhere 88 89 of which EMEA region Europe Middle East Africa 61 63 of which AA region Asia and Australia 27 26 Negative interest included in the interest income and positive interest included in the interest  expenses are disclosed separately in the income statement as prior-year figures in the form  of a sub-item,INTEREST
Siemens Bank 2022,They result mainly from funding transactions with the shareholder and from  liquidity investments,INVESTMENT
Siemens Bank 2022,For the Siemens Bank lending book negative interest is of minor signifi- cance due to the structure of the terms and the geographical diversification,INTEREST
Siemens Bank 2022,In addition to deferred  taxes taxes on income also include payments and additions to provisions both for current  income taxes as well as refunds in the amount of 156 thousand for previous years,FUNDS
Siemens Bank 2022,Under this profit-and-loss transfer agreement the entire net income after tax determined in  accordance with the HGB amounting to 21104082,PROFIT
Siemens Bank 2022,Annual financial statements Notes to the financial statements Balance sheet disclosures 49 Annual Report 2022  Siemens Bank  17 Other liabilities The breakdown of other liabilities is as follows 000 2022 2021 Other liabilities 28331 73021 Liabilities to the shareholder 21104 66091 Withholding tax and duties to be paid 2693 2823 VAT liabilities and other items 3366 2538 Personnel-related obligations 1168 1569 Liabilities to the shareholder mainly include the profit-and-loss transfer agreement,PROFIT
Siemens Bank 2022,For the most part the benefits are based  on the companys contributions made to the scheme and on the investment income from  these contributions whereby the company guarantees a minimum return,INVESTMENT
Siemens Bank 2022,The fund units are only used to cover the resulting pension obligations and are  protected against claims from other creditors,CREDIT
Siemens Bank 2022,These assets which had a fair value deter - mined using recognized valuation methods stock market prices of 1059 thousand as of  September 30 2022 previous year 1052 thousand and a cost value of 943 thousand   previous year 800 thousand are therefore fully offset against the pension obligations  up to the amount of these obligations of 1041 thousand previous year 944 thousand,STOCK
Siemens Bank 2022,Siemens Bank only has an indirect liability for these obligations if the resources of the  Trust turn out to be inadequate to cover the pension obligations,LIABILITY
