Bank Name,Financial Text,Financial Term
Deutsche Bank,Revenue  growth was driven by higher net interest income from deposit products as the net interest margin increased to 2,REVENUE
Deutsche Bank,This was in part offset by lower fee income lower loan revenues in a ris ing interest rate  environment and negative foreign exchange rate movements,REVENUE
Deutsche Bank,The Private Bank attracted net inflows into assets under man- agement of  9 billion in the quarter with net inflows in both investment products and deposits,INVESTMENT
Deutsche Bank,Quarterly loan develop ment  reflected lower client demand against a backdrop of rising interest rates mainly in mortgage loans in Germany as well as clie nt  deleveraging in APAC,INTEREST
Deutsche Bank,Net revenues in the Private Bank Germany grew significantly by 16 to  1,REVENUE
Deutsche Bank,G rowth was driven by  higher net interest income from deposit products which more than offset impacts from lower fee income due to changes in  contractual conditions,INTEREST
Deutsche Bank,In the International Private Bank net revenues were  845 million down 13 year on year  or up 2 if adjusted for the  aforementioned impact of specific items the non -recurring revenues of approximately  15 million following a business divest- iture in Deutsche Bank Financial Advisors in Italy in the fourth quarter of 2022 and negative year ov er year foreign exchange  movements of  20 million,REVENUE
Deutsche Bank,Higher deposit revenues were offset by lower loan and investment revenues mainly in the APAC  region,REVENUE
Deutsche Bank,Adjusted costs which exc lude  these items were up 5 mainly reflecting investmen ts in infrastructure control improvements and higher internal cost alloca- tions  whereas costs in the prior year period included a beneficial impact from deposit protection costs,DEPOSIT
Deutsche Bank,Provision for credit losses was  174 million or 27 basis points of average loans compared to 24 basis points of average  loans in the prior year quarter,LOSS
Deutsche Bank,For the first nine months of 2023 profit before tax was  800 million down 34 year on year,PROFIT
Deutsche Bank,This  development reflected a  8 increase in net revenues to  7,REVENUE
Deutsche Bank,Provision for credit lo sses  was   588 million up from  358 million in the prior year period largely reflecting a small number of single name losses in the  International Private Bank in the first quarter of 2023,LOSS
Deutsche Bank,Adjusted  for the non -recurrence of  119 million in revenues from Sal,REVENUE
Deutsche Bank,Oppenheim workout activities in the prior year and nonoperating  costs of   325 million in 2023 compared to a benefit of  126 million in the prior year period profit before tax would have been  up 17 year on year,PROFIT
Deutsche Bank,unless stated otherwise   Sep 30  2023   Sep 30  2022   Absolute   Change   Change   in   Sep 30  2023   Sep 30  2022   Absolute   Change   Change   in   Net revenues                   Private Bank Germany    1497    1290    207   16   4582    3973    609   15  International Private Bank    845   977   132   13   2598    2674    76   3  Premium Banking    245   214   31   14   744   690   53   8  Wealth Management  Bank for Entre- preneurs    601   764   163   21   1854    1983    129   7  Total net revenues    2343    2267    75   3   7180    6647    533   8  Of which                   Net interest income    1512    1287    225   17   4587    3745    842   22  Commissions and fee income    714   758   45   6   2215    2498    283   11  Remaining income    117   222   105   47   378   404   26   6  Provision for credit losses    174   161   14   9   588   358   230   64  Noninterest expenses                   Compensation and benefits    693   698   4   1   2098    2081    16   1  General and administrative expenses    1137    1028    109   11   3560    3092    468   15  Impairment of goodwill and other intangi- ble assets    0   0   0   NM   0   0   0   NM  Restructuring activities    0   14   15   NM   135   94   229   NM  Total noninterest expenses    1831    1711    119   7   5792    5079    713   14  Noncontrolling interests    0   0   0   NM   0   0   0   NM  Profit loss before tax    337   395   58   15   800   1210    410   34                    Employees front office full -time equiva- lent1   20828    21453    626   3   20828    21453    626   3  Employees business -aligned opera- tions full -time equivalent1   5735    5949    214   4   5735    5949    214   4  Employees allocated central infrastruc- ture full -time equivalent1   11850    10123    1727    17   11850    10123    1727    17  Total employees full -time equivalent1   38413    37525    887   2   38413    37525    887   2  Total assets in  bn12   329   334   5   2   329   334   5   2  Risk-weighted assets in  bn1   86   87   0   0   86   87   0   0  of which operational risk RWA in  bn1   8   7   0   5   8   7   0   5  Leverage exposure in  bn1   338   345   7   2   338   345   7   2  Deposits in  bn1   309   322   13   4   309   322   13   4  Loans gross of allowance for loan  losses in  bn1   263   269   6   2   263   269   6   2  Assets under Management in  bn13   547   529   18   3   547   529   18   3  Net flows in  bn    9   8   2   20   22   25   3   10  Costincome ratio   78,REVENUE
Deutsche Bank,the amounts do not include intersegment balances   3 The Group defines assets under management as a assets held on behalf of customers for investment purposes andor b client  assets that are managed by the bank  assets under manag ement are managed on a discretionary or advisory basis or these assets are deposited with the bank deposits are considered assets under management  if they serve investment purposes in the Private Bank Germany and Premium Banking this includes term depo sits and savings deposits in Wealth Management  Bank for  Entrepreneurs it is assumed that all customer deposits are held with the bank primarily for investment purposes       21  Deutsche Bank   Segment results    Earnings Report  as of September  30 2023         Asset Management   Profit before tax was  109 million in the third quarter a 18 de crease over the prior year period driven by lower revenues  while costs were reduced,REVENUE
Deutsche Bank,Net revenues were  594 million down 10 over the prior year period,REVENUE
Deutsche Bank,This development principally reflected lower perfor- mance fees the mark -to-market of co -investments and foreign exchange  rate movements,INVESTMENT
Deutsche Bank,Noninterest expenses were  444 million in the quarter a reduction of 8 year -on-year,INTEREST
Deutsche Bank,For the first nine months of 2023 Asset Management reported a profit before tax of  326 million down 34 versus   495 mil- lion for the same period in 2022,PROFIT
Deutsche Bank,unless stated otherwise   Sep 30  2023   Sep 30  2022   Absolute   Change   Change   in   Sep 30  2023   Sep 30  2022   Absolute   Change   Change   in   Net revenues                   Management Fees    589   626   36   6   1740    1865    125   7  Performance and transaction fees    19   38   19   50   87   95   8   9  Other    13   3   11   NM   24   38   62   NM  Total net revenues    594   661   66   10   1803    1998    195   10  Provision for credit losses    0   0   0   45   1   0   1   189  Noninterest expenses                   Compensation and benefits    221   245   24   10   677   699   22   3  General and administrative expenses    223   239   16   7   676   659   17   3  Impairment of goodwill and other intangi- ble assets    0   0   0   NM   0   0   0   NM  Restructuring activities    0   0   0   50   0   1   1   68  Total noninterest expenses    444   484   40   8   1354    1359    5   0  Noncontrolling interests    42   44   2   4   124   145   21   14  Profit loss before tax    109   133   24   18   326   495   169   34                    Employees front office full -time equiva- lent1   2018    1982    37   2   2018    1982    37   2  Employees business -aligned opera- tions full -time equivalent1   2318    2358    39   2   2318    2358    39   2  Employees allocated central infrastruc- ture full -time equivalent1   560   513   47   9   560   513   47   9  Total employees full -time equivalent1   4897    4852    44   1   4897    4852    44   1  Total assets in  bn12   10   11   1   6   10   11   1   6  Risk-weighted assets in  bn1   15   13   2   16   15   13   2   16  of which operational risk RWA in  bn1   4   3   0   3   4   3   0   3  Leverage exposure in  bn1   9   9   0   1   9   9   0   1  Assets under Management in  bn1   860   833   26   3   860   833   26   3  Net flows in  bn    2   8   5   NM   17   18   36   NM  Costincome ratio   74,REVENUE
Deutsche Bank,the amounts do not include intersegment balances     22  Deutsche Bank   Segment results    Earnings Report  as of September  30 2023         Corporate  Other   Corporate  Other CO reported a loss before tax of  195 million in the third quarter compared to a loss before tax of   28 million in the prior year quarter,LOSS
Deutsche Bank,This was driven primarily by higher noninterest expenses,INTEREST
Deutsche Bank,Net revenues were  35 million in the quarter compared to  55 million in the prior y ear quarter,REVENUE
Deutsche Bank,The reduction was primarily  driven by revenues relating to valuation and timing differences of  157 million down from  200 million in the prior year  quarter,REVENUE
Deutsche Bank,Revenues related to funding and liquidity were negative  54 million in the third quarter of 2023 compared to negative   28 million in the prior year quarter,REVENUE
Deutsche Bank,Noninterest expenses were  270 million in the quarter compared to  148 million in the prior year quarter with the increas e  mostly driven by higher nonoperating costs,INTEREST
Deutsche Bank,Noncontrolling interests are reversed in CO after deduction from the divisional profit before tax,PROFIT
Deutsche Bank,For the first nine months the loss before tax was  539 million less than half the loss of the prior year period,LOSS
Deutsche Bank,This deve lopment  was primarily driven by revenues of  110 million up from negative  667 millio n in the prior year period which more than  offset the impact of a 12 year -on-year rise in noninterest expenses to  780 million,REVENUE
Deutsche Bank,unless stated otherwise   Sep 30  2023   Sep 30  2022   Absolute   Change   Change   in   Sep 30  2023   Sep 30  2022   Absolute   Change   Change   in   Net revenues    35   55   20   36   110   667   777   NM  Provision for credit losses    3   18   15   83   6   3   3   114  Noninterest expenses                   Compensation and benefits    852   823   29   4   2506    2425    81   3  General and administrative expenses    583   675   92   14   1726    1729    3   0  Impairment of goodwill and other intangi- ble assets    0   0   0   NM   0   0   0   NM  Restructuring activities    1   0   1   NM   0   1   1   91  Total noninterest expenses    270   148   123   83   780   694   86   12  Noncontrolling interests    37   47   10   21   125   152   26   17  Profit loss before tax    195   28   168   NM   539   1207    668   55                    Employees CO net full -time equiva- lent1   1405    2407    1002    42   1405    2407    1002    42  Employees central infrastructure allo- cated to businesses full -time equiva- lent1   33559    29095    4464    15   33559    29095    4464    15  Total Employees full -time equivalent1   34964    31502    3462    11   34964    31502    3462    11  Risk-weighted assets in  bn1   42   49   7   15   42   49   7   15  Leverage exposure in  bn1   38   44   6   13   38   44   6   13                   NM  Not meaningful   Prior years comparatives aligned to presentation in the current year   1 As of quarter -end    23  Deutsche Bank   Consolidated balance sheet    Earnings Report  as of September  30 2023         Consolidated balance sheet   Assets   in  m,REVENUE
Deutsche Bank,Sep 30 2023   Dec 31 2022   Cash and central bank balances    169678    178896   Interbank balances without central banks    6209    7195   Central bank funds sold and securities purchased under resale agreements    14135    11478   Securities borrowed    122   0  Financial assets at fair value through profit or loss       Trading assets    112602    92867   Positive market values from derivative financial instruments    287597    299686   Non-trading financial assets mandatory at fair value through profit and loss    88849    89654   Financial assets designated at fair value through profit or loss    169   168  Total financial assets at fair value through profit or loss    489217    482376   Financial assets at fair value through other comprehensive income    32820    31675   Equity method investments    1002    1124   Loans at amortized cost    479713    483700   Property and equipment    6132    6103   Goodwill and other intangible assets    7333    7092   Other assets1   143370    118293   Assets for current tax    1563    1584   Deferred tax assets    6978    7272   Total assets    1358272    1336788          Liabilities and equity   in  m,PROFIT
Deutsche Bank,Sep 30 2023   Dec 31 2022   Deposits    611305    621456   Central bank funds purchased and securities sold under repurchase agreements    3486    573  Securities loaned    21   13  Financial liabilities at fair value through profit or loss       Trading liabilities    47572    50616   Negative market values from derivative financial instruments    271342    282353   Financial liabilities designated at fair value through profit or loss   84391    54634   Investment contract liabilities    478   469  Total financial liabilities at fair value through profit or loss    403783    388072   Other short -term borrowings    8798    5122   Other liabilities1   136038    113714   Provisions    2733    2449   Liabilities for current tax    654   388  Deferred tax liabilities    692   650  Long -term debt    116358    131525   Trust preferred securities    514   500  Total liabilities    1284381    1264460   Common shares no par value nominal value of  2,PROFIT
Deutsche Bank,Central bank funds purchased securities sold under repurchase agreements and securities loaned across all applicable meas- urement categories increased by  28,FUNDS
Deutsche Bank,The Group maintains additional highly liquid central bank eligible assets not qualifying as HQLA or  subject to transfer restrictions under the HQLA definition,RESTRICTIONS
Deutsche Bank,The Liquidity Coverage Ratio was  132 in the third quarter of 2023 a surplus to regulatory requirements of  5 1 billion,REGULATORY
Deutsche Bank,This change was driven  by a number of factors including the profit reported for the period of   3,PROFIT
Deutsche Bank,These were partially offset by  net purchases of treasury shares of  678 million coupons paid on additional equity components of  498 million as well as  cash dividends paid to  Deutsche Bank shareholders of  610 million,EQUITY
Deutsche Bank,dollar against the  Euro a net change in sha re awards for the period of  184 million and cash dividends paid to noncontrolling interests of   92 million,INTEREST
Deutsche Bank,The shares had already been deducted from the reported  total equity on December 31 2022,EQUITY
Deutsche Bank,Therefore the cancellation did not reduce the reported total equity in the first nine mon ths  of 2023,EQUITY
Deutsche Bank,The repurchase of these shares has  reduced the reported total equity by  271 million as of September 30 2023,EQUITY
Deutsche Bank,The Federal Reserve is not expected to raise interest rates further,INTEREST
Deutsche Bank,Net interest margin which had improved in line with key interest rates is expected to come under some pressure,INTEREST
Deutsche Bank,Together with slowing volume growth as a  result of weaker demand the boom in net interest income could soften,INTEREST
Deutsche Bank,Nevertheless record -high industry -wide profitability fo r the full year could be in reach given the best nominal results ever  registered in the first six months both in the U,PROFIT
Deutsche Bank,banks might focus more on building up capital given a lower CET1 starting level and a greater impact of unrealized  losses on bond portfolios,LOSS
Deutsche Bank,Files that are open include the Listings Act Retail Investment  Strategy the digital euro open finance Corporate Sustainability Due Diligence Directive the review of the Payment Service s  framework the review of the European Markets Infra structure framework EMIR 3,INVESTMENT
Deutsche Bank,Deutsche Bank reaffirms the banks financial targets to be achieved by 2025 of a post -tax return on average tangible equity  of above 10 a compound annual revenue growth of between 3,REVENUE
Deutsche Bank,The ban k expects Group revenues to be slightly higher in 2023 compared to the prior year,REVENUE
Deutsche Bank,Deutsche Bank expects the growth  momentum experienced in the first nine months to continue for the remainder of 2023  with revenues at around   29 billion in  line with the ba nks guidance range of  28 billion to  29 billion,REVENUE
Deutsche Bank,This is driven by strong net interest income momentum in  Corporate Bank and Private Bank as well as the beginning of recovery in the Investment Banks Origination  Advisory busi- ness,INVESTMENT
Deutsche Bank,Corporate Bank  expects the strong momentum in the first nine months of 2023 to continue for the full year with its performance  being supported by the interest rate environment and strategic initiatives despite macro -economic uncertainties,INTEREST
Deutsche Bank,Revenues  are expected to be high er compared to the prior year with growth across all three client segments driven by improvements in  interest rates pricing discipline and further impacts of the segments growth initiatives,REVENUE
Deutsche Bank,Corporate Treasury Services revenues are anticipated to be hig her with a strong momentum in the Corporate Cash Manage- ment business and growth in noninterest revenues,REVENUE
Deutsche Bank,Corporate Cash Management revenues will continue to be driven by the  net interest income from interest rates above prior year pricing discipline and a  strong deposit base,REVENUE
Deutsche Bank,Trade Finance  Lending  revenues will be impacted by the continued selective balance sheet deployment and reduced funding benefits including from  the ECBs TLTRO program partially offset by higher commission and fee income,REVENUE
Deutsche Bank,Instituti onal Client Services revenues are  expected to be higher supported by higher interest rates,REVENUE
Deutsche Bank,In Business Banking revenues are expected to be significantly  higher compared to the prior year from growth in net interest income principally due to higher inte rest rates in Germany and  supported by stable loan volumes and deposit balances,REVENUE
Deutsche Bank,Investment Bank  revenues are expected to be slightly lower in 2023 compared to the prior year,REVENUE
Deutsche Bank,FIC Sales and Trading revenues are expected to be lower than in 2022,REVENUE
Deutsche Bank,Global Emerging Markets will continue to develop the business onshore footprint and client workflow solutions further alt- hough volatility levels in the Central  Eastern Europe Middle East  Africa region and associated revenues seen in 2022 are   unlikely to be  repeated,REVENUE
Deutsche Bank,The Foreign Exchange business was negatively impacted by the extreme interest rate volatility in the  first quarter of 2023 while the second and third quarter saw reduced currency volatility resulting in lower activity,INTEREST
Deutsche Bank,Within Credit Trading the flow credit business is building on investments into product  and coverage teams which have contributed to improved performance in the first nine months of the year and will look to  maintain the momentum  from strong performance in the distressed business,INVESTMENT
Deutsche Bank,The Financing business will continue to take a  disciplined and selective approach to the deployment of resources and look to benefit from the increase in interest rates see n  over the last twelve months,INTEREST
Deutsche Bank,Despite this Origination  Advisory revenues are expected to be signifi- cantly higher in 2023 compared to 2022 driven by Debt Origination,REVENUE
Deutsche Bank,Equity Origination will continue to provide a competitive offering across products and  expects to fur ther benefit from an improved market environment which started in the second quarter of 2023,EQUITY
Deutsche Bank,Advisory plans  to build on the momentum of investment that has been made throughout the year however the reduced levels of announced  volumes seen over the last year have materially lowered the industry fee pool in the first nine months of 2023,INVESTMENT
Deutsche Bank,This has  impacted revenues year to date and will continue to do so for the remainder of the year,REVENUE
Deutsche Bank,The year on year comparison  will be impacted by the non -recurrence of a gain on the sale of the Deutsche Bank Financial Advisors business in Italy and by  lower revenues from workout activities in Sal,REVENUE
Deutsche Bank,Revenues excluding th ese specific items are expected to be higher  compared to 2022 driven by net positive effects from the rising interest rate environment and by continued business growth  despite an expected slowdown in loan volume growth,REVENUE
Deutsche Bank,In Private Bank Germany revenues a re expected to be higher compared to 2022,REVENUE
Deutsche Bank,Net interest income is expected to grow  driven by higher deposit revenues which will be partly offset by reduced funding benefits,REVENUE
Deutsche Bank,Fee income from investment product revenues is expected to be  essentially flat,REVENUE
Deutsche Bank,Net revenues in International Private Bank are expected to be lower compared to 2022 driven by the non -recurrence of the  aforementioned gain on sale in Italy of a pproximately  310 million and Sal,REVENUE
Deutsche Bank,Oppenheim workout revenues of approximately   130 million,REVENUE
Deutsche Bank,Excluding these specific items revenues are anticipated to be essentially flat year on year,REVENUE
Deutsche Bank,Positive impacts  driven by deposit products in EMEA are expected to  be in part offset by continued headwinds in the APAC region reduced  funding benefits and forgone revenues after the aforementioned business sale,REVENUE
Deutsche Bank,Driven by the current market development assets under management AuM volumes are now expected to be slightly higher  compared to year end 2022 reflecting continued net inflows in both investment products and deposits,INVESTMENT
Deutsche Bank,The overall development  of AuM volum es is highly dependent on financial market conditions including equity indices and foreign exchange rates,EQUITY
Deutsche Bank,Growth dynamics in the loan businesses in the Private Bank are expected to slow down mainly reflecting lower client demand  against a backdrop of ris ing interest rates mainly in mortgage loans in Germany as well as client deleveraging  in APAC,INTEREST
Deutsche Bank,Asset Management  expects total net revenues to be lower for the full year 2023 compared to the prior year driven by slightly  lower management fees mark  to market of co -investments and FX impact,REVENUE
Deutsche Bank,Management fees and performance and transac- tion fees are expected to be slightly lower in 2023 and other revenues to be significantly lower,REVENUE
Deutsche Bank,For 2023 Corporate  Other  is expected to generate a pre -tax loss and as previously reported will include financial impacts  of legacy portfolios previously reported as the Capital Release Unit,LOSS
Deutsche Bank,The pre - tax loss associated with legacy portfolios is expected to be lower than the equivalent pre -tax loss in 2022 primarily from lower  noninterest expenses,LOSS
Deutsche Bank,For  2023 the bank expects noninterest expenses to be slightly higher compared to 2022,INTEREST
Deutsche Bank,Benefits from these mea sures in the year are expected to be  partially or fully offset by inflationary pressures as well as the impact of selective investments in further business growth  and  temporarily higher -than-expected costs in relation to the retirement of legacy technology  infrastructure and the operational  backlog currently experienced in the Postbank IT migration program,INVESTMENT
Deutsche Bank,For the full year 2023 the Group expects provision for credit losses at the upper end of the banks guidance range of 25 to 30  basis points of average loans reflecting the uncertain macroeconomic backdrop and lower loan balances than initially antici- pated,LOSS
Deutsche Bank,The bank expects provision for credit losses in 2023 unlike in 2022 to be driven by single -name losses rather than a  deterioration of macro -economi c forward -looking variables,LOSS
Deutsche Bank,Further details on the calculation of expected credit losses are provided in the  section Risk information in this report,LOSS
Deutsche Bank,The bank received several regulatory decisions on internal credit and market risk models in the first nin e  months of 2023 with smaller ones expected in the fourth quarter of 2023,CREDIT
Deutsche Bank,Deutsche Bank ai ms for a Common Equity Tier 1 capital ratio of 200 basis points above the Maximum Distributable Amount  MDA threshold at the end of 2023,EQUITY
Deutsche Bank,Deutsche Bank is committed to delivering sustainable growth on cash dividends and over time returning excess capit al that  is over and above what is required to support profitable growth and upcoming regulatory changes to shareholders through  share buybacks subject to regulatory approval shareholder authorization and meeting German corporate law requirements,PROFIT
Deutsche Bank,By the nature of its business Deutsche Bank is involved in litigation arbitration and regulatory proceedings and investigat ions  in Germany and in a number of jurisdictions outside Germany including in the United States,REGULATORY
