Bank Name,Financial Text,Financial Term
Siemens Bank 2022,to take account of the wider effects of our investments  in technology and projects on mankind and society,INVESTMENT
Siemens Bank 2022,Christoph Baumgarten   Chief Financial Officer Member   Management Board Our green financing for three wastewater treat- ment plants in Saudi Arabia Madinah 3 Tabuk 2  and Buraydah 2 ISTPs will help optimize the use of  water resources by providing recycled water reduc- ing the consumption of fresh water and contributing  to Saudi Arabian water security,SECURITY
Siemens Bank 2022,These suc- cesses are bright spots in a tumultuous year and serve  to highlight our overarching commitment to ensuring  energy transition and security of supply and to invest- ing in fundamental infrastructure for the benefit of all  in the long term,SECURITY
Siemens Bank 2022,Deposit and treasury business The deposit business focus- es on the receipt and investment of overnight money and  time deposits from companies within the Siemens Group  and selected third-party institutions,INVESTMENT
Siemens Bank 2022,The treasury business  encompasses Group financing activities and asset liability  management including the management of a portfolio of  highly liquid assets,LIABILITY
Siemens Bank 2022,Asset liability management ensures  that the lending business is funded by equity and deposits,LIABILITY
Siemens Bank 2022,Central banks in many indus- trialized and emerging countries have reacted to above-target  inflation with more stringent monetary policies and raised  interest rates thus tightening financing conditions for com- panies in a way that curbs economy activity,INTEREST
Siemens Bank 2022,Overall how - ever the interest rate increases already implemented or still  expected by the central banks  especially in the eurozone   are moderate compared to the extent of inflation,INTEREST
Siemens Bank 2022,At the beginning of the year the economy in Europe recov - ered from the economic impact of the COVID-19 pandemic  and the accompanying lifting of restrictions is supporting  private consumption,RESTRICTIONS
Siemens Bank 2022,In terms of overall new business environment the first and  second quarters of the fiscal year were characterized by a sig- nificant increase in refinancing and new business due to the  further economic recovery after the severe restrictions of the  COVID-19 pandemic,RESTRICTIONS
Siemens Bank 2022,In the financing of projects and equipment investments for  which longer-term and therefore less cyclical planning cycles  are regularly relevant as well as in project financing in the  infrastructure sector which has proven to be quite resilient   to credit defaults even in the environment of the COVID-19  pandemic Siemens Bank continues to observe ongoing  intense competition in the search for attractive risk-return  profiles,INVESTMENT
Siemens Bank 2022,Due to the difficult macroeco- nomic environment and the overall significant increase in  interest rates higher interest margins than in previous years  could once more be achieved in some asset classes,INTEREST
Siemens Bank 2022,The current CRR III draft includes in particular far-reaching  changes in the Credit Risk Standardized Approach STA the  Internal Ratings-Based Approach IRBA as well as in the   capital requirements for operational risk,CREDIT
Siemens Bank 2022,Particularly noteworthy are among other  things the suitability and reliability of management body  members fit  proper as well as the regulations on SREP  and the inclusion of ESG factors in risk management,LIABILITY
Siemens Bank 2022,The simplifications in German reporting practice which   were enacted by the regulatory authority in the course of  COVID-19 largely expired as of June 30 2022,REGULATORY
Siemens Bank 2022,The European Parliaments Digital Operational Resilience Act  DORA the final version of which is still expected in 2022  contains requirements relating to information and commu- nication ICT risk management classification and reporting  of ICT-related incidents digital operational resilience testing  contractual arrangements between third-party ICT service  providers and financial institutions the regulatory frame- work for critical third-party ICT service providers and rules  for information sharing,REGULATORY
Siemens Bank 2022,The new Siemens Bank branch founded in Singapore in  March 2017 is required to comply with local regulatory  requirements and reporting obligations in the Monetary  Authority of Singapore MAS reporting system,REGULATORY
Siemens Bank 2022,The local  regulatory requirements are based on the Basel III Framework  and are essentially comparable with the European require- ments,REGULATORY
Siemens Bank 2022,The monitoring and development of changes and  adjustments to local regulatory requirements is also part of  Siemens Banks Compliance Program,REGULATORY
Siemens Bank 2022,Prof- itability of the portfolio which is reflected in a significant  increase in net interest income also exceeds expectations  overall,INTEREST
Siemens Bank 2022,The significant increase in additions to provisions for  losses on loans and advances is primarily due to the provi- sioning for an exposure in the European energy infrastruc- ture sector which has been adversely affected by the Ukraine  conflict,LOSS
Siemens Bank 2022,As a result profit from operations is significantly below  Siemens Banks planning primarily due to the aforemen- tioned provisioning,PROFIT
Siemens Bank 2022,In the deposit and treasury business the Group financ- ing portfolio which forms an integral part of the loans and  advances to customers fell to 76 million previous year  116 million,DEPOSIT
Siemens Bank 2022,The provision of collateral in cash means that  Siemens Bank does not bear any credit risk in connection  with this business,CREDIT
Siemens Bank 2022,Within the deposit and treasury business the development  of liquidity-related investments  which are reported under  loans and advances to banks credit balances with central  banks private bonds as well as under loans and advances to  customers  is closely linked to the economic and regulatory  requirements relating to liquidity control,INVESTMENT
Siemens Bank 2022,A major part of this  asset portfolio is in short-term promissory note loans from  investment-grade issuers,INVESTMENT
Siemens Bank 2022,With this asset portfolio Siemens   Bank intends to achieve positive income contributions and a  high level of security in addition to compliance with commer - cial and legal requirements regarding liquidity control,SECURITY
Siemens Bank 2022,In the 2022 fiscal year liquidity investments at the central  bank were generally slightly higher than in previous years,INVESTMENT
Siemens Bank 2022,These are due to short-term investments by the Siemens   Group as is the significant increase in the second quarter  of the 2021 fiscal year which only lasted for a few weeks,INVESTMENT
Siemens Bank 2022,This means that liquidity-related investments were at the  expected level,INVESTMENT
Siemens Bank 2022,Figure 2 Change in liquidity-related investments in the ALM and treasury  business  millionQ1 Q2 Q3 Q4 Q1 Q2 Q3 Q4 Q1 Q2 Q3 Q4 2020 2021 202214000,INVESTMENT
Siemens Bank 2022,Here 10 previous year 12 of the  recorded business volume of Siemens Bank is financed by  equity,EQUITY
Siemens Bank 2022,Siemens AG as the sole shareholder of Siemens Bank  has paid in a share capital of 5000 thousand previous year  5000 thousand and capital provisions in the form of oth- er payments into equity amounting to 995000 thousand  previous year 995000 thousand,EQUITY
Siemens Bank 2022,Although by far the largest proportion of deposits is made  by Siemens AG and its subsidiaries Siemens Bank also holds  deposits of customers from outside the Group,DEPOSIT
Siemens Bank 2022,However  Siemens Bank does not accept retail banking deposits,DEPOSIT
Siemens Bank 2022,Where  deposits are used directly for the purpose of funding the len- ding business they are matched as far as possible with the  lending currencies in accordance with the expected repay - ment profiles so that the exposure of Siemens Bank to cur - rency and maturity transformation risk is limited,DEPOSIT
Siemens Bank 2022,Currently Siemens Bank has not issued any bonds on capital  markets nor has it placed any promissory note loans or other  bonds,BONDS
Siemens Bank 2022,Furthermore Siemens Bank has not made any substantial  capital investments or financial investments in the 2022   fiscal year,INVESTMENT
Siemens Bank 2022,Results of operations The 2022 fiscal year saw strong operational performance with  an increase in the lending portfolio and higher interest mar - gins which is reflected in significantly improved net inter - est income after the moderate growth of the previous year,INTEREST
Siemens Bank 2022,Nevertheless additions to allowances for losses on loans and  advances were significantly higher than in the previous year  due primarily to provisioning for an exposure in the European  energy infrastructure sector that was adversely affected by  the Ukraine conflict,LOSS
Siemens Bank 2022,As a result Siemens Bank was not able to match the positive  development of the 2020 and 2021 fiscal years but achieved  by far the highest operating income before allowances for  losses on loans and advances since the Banks formation  despite the challenging developments in connection with   the Ukraine crisis,LOSS
Siemens Bank 2022,Interest terms also reflect the effect of inflation,INTEREST
Siemens Bank 2022,The  net interest margin contribution from the lending business  generates most of the net interest income,INTEREST
Siemens Bank 2022,Liquidity-related  investments in the deposit and treasury business normally  generate lower interest margins,INVESTMENT
Siemens Bank 2022,As the portfolio in the core  lending business grew strongly in the 2022 fiscal year after  moderate growth in the previous year the increase in net  interest income reflects the increased average portfolio vol- ume,INTEREST
Siemens Bank 2022,Nominal net interest income is also heavily dependent  on the volatility of exchange rates during the year as a signif- icant portion of the portfolio is denominated in USD GBP and  AUD,INTEREST
Siemens Bank 2022,Since growth in the lending  business portfolio in the 2022 fiscal year was stronger than  in previous years and net interest margins were success- fully increased the increase in net interest income exceeds  Siemens Banks expectations,INTEREST
Siemens Bank 2022,The relative increase in general admin- istration expenses in the past fiscal year was below the rela- tive increase in net interest income and thus in line with the  Banks expectations,INTEREST
Siemens Bank 2022,As in the previous year the increase  is primarily due to higher personnel expenses significant- ly increased regulatory costs and upfront expenses for the  development of EPT as a new business segment,REGULATORY
Siemens Bank 2022,The impact of  currency effects on the Banks profitability is limited espe- cially due to the funding of loans in foreign currencies in the  same currency,PROFIT
Siemens Bank 2022,Expenses for additions to allowances for losses on loans  and advances increased significantly in the 2022 fiscal year  compared to the previous year and were thus higher than  expected by Siemens Bank at the beginning of the fiscal year,LOSS
Siemens Bank 2022,In general the structure  of the lending portfolio  a high proportion of project financ- ing in the infrastructure sector and of corporate lending  transactions with equity sponsors from the private equity   sector  predominantly proved to be resilient to credit  defaults also during the Ukraine crisis and against the back - ground of increased macroeconomic uncertainties,EQUITY
Siemens Bank 2022,This effect dominates the item allowances  for losses on loans and advances and is primarily responsible  for the increase compared to previous years,LOSS
Siemens Bank 2022,Overall the con- tinued good credit quality of the receivables portfolio and the  broad diversification by sector and region also contributed to  the fact that the balance sheet allowances for losses on loans  and advances for large parts of the lending portfolio contin- ued to be very moderate overall in the 2022 fiscal year,LOSS
Siemens Bank 2022,Net operating income equates to the net income in   accordance with the German Commercial Code HGB that  Siemens Bank transfers to Siemens AG under the existing  profit-and-loss transfer agreement after deduction of addi- tions to the fund for general banking risks and of income  taxes,PROFIT
Siemens Bank 2022,In  addition to the increase in net interest income this is mainly  due to the negative development of risk provisions,INTEREST
Siemens Bank 2022,This includes  continuous compliance with and monitoring of the equity  large obligor liquidity and compensation standards as well as  the German Minimum Requirements for Risk Management at  Banks MaRiskBA,EQUITY
Siemens Bank 2022,Also the Bank ensures continuous com- pliance with the regulatory requirements for the operations  of its branch offices,REGULATORY
Siemens Bank 2022,These rules and regulations docu- ment in particular the processes for granting loans further  processing of loans monitoring of loan processing intensi- fied and problem obligor management risk classification and  review of credit ratings together with the processes for asset  liability management,LIABILITY
Siemens Bank 2022,In particular the  Risk Committee is responsible for managing and monitoring  the credit portfolio,CREDIT
Siemens Bank 2022,Authority in relation to credit decisions on significant loan  exposures is vested in the Credit Committee in accordance  with the authority rules and regulations,CREDIT
Siemens Bank 2022,Voting members of the Credit  Committee are the CEO CFO and CRO as well as the head of  the EPT business of Siemens Bank,CREDIT
Siemens Bank 2022,The Asset Liability Management Committee ALM Committee  is responsible for managing and limiting market liquidity and  funding risk,LIABILITY
Siemens Bank 2022,Ultimate decision-making authority in all issues  related to asset liability management and therefore also  related to the management of market liquidity and fund- ing risk lies with the ALM Committee,LIABILITY
Siemens Bank 2022,Within this unit the Credit Risk Controlling depart- ment is responsible for monitoring credit risk and the Pricing   Integrated Risk Controlling department is responsible for  monitoring market liquidity and operational risk as well as  for matters relating to integrated risk-return management,CREDIT
Siemens Bank 2022,The head of Risk Controlling  Analytics sits on the Risk Com- mittee the ALM Committee and the Credit Committee and  also participates in the meetings of the Outsourcing Com- mittee and of the Compliance Committee and is therefore  comprehensively involved in all aspects of decision-making  processes relevant to risk policy,CREDIT
Siemens Bank 2022,Regarding further compliance-relevant internal  provisions such as regulatory questions or implementation  of MaRisk the central function is assisted by Risk Control- ling and Regulatory Reporting,REGULATORY
Siemens Bank 2022,Default risk is largely reported within the context of the  monthly credit risk report,CREDIT
Siemens Bank 2022,Reports focus on the economic  and regulatory capital requirement for the credit risks adopt- ed by the Bank and on a detailed portfolio analysis regarding  concentration risk adopted by the Bank,CREDIT
Siemens Bank 2022,The analysis of con- centration risk includes country risk industry risk concentra- tions in particular credit-rating categories and concentrations  in individual obligors,CREDIT
Siemens Bank 2022,Risk reporting is focused on the economic   capital requirement for the funding risk taken on by the Bank  on monitoring the operational liquidity and funding limits  and on the regulatory key indicators relating to the liquid- ity coverage ratio and net stable funding ratio as well as the  minimum liquid assets for the Singapore Branch,REGULATORY
Siemens Bank 2022,Losses in excess of 50000 are reported  on an ad hoc basis to the Management Board,LOSS
Siemens Bank 2022,The monitoring and control of economic and regulatory  capital adequacy enables the Bank to ensure on an ongoing  basis that the risk taken on by the different fields of activity  at Siemens Bank is always consistent with the available capi- tal both at the bank-wide level and within individual types of  risk,REGULATORY
Siemens Bank 2022,Key performance indicators of pricing are the  Economic Value Added EVA and the Return on Equity RoE  based on the economic capital Return on Risk adjusted   Capital RoRaC,EQUITY
Siemens Bank 2022,The normative perspective combines the requirements of  regulatory capital adequacy and internal capital adequacy  with the objective of ensuring regulatory capital adequacy   at all times,REGULATORY
Siemens Bank 2022,The core of the  risk- taking potential consists of the regulatory tier 1 and  tier 2 capital and is referred to as the core risk-taking poten- tial,REGULATORY
Siemens Bank 2022,Expected losses potential costs from eliminating liquid- ity gaps and administration costs for the portfolio are also  taken into account in the calculation,LOSS
Siemens Bank 2022,The core risk-tak - ing potential corresponds to the regulatory capital without  adjustment for prudential valuation,REGULATORY
Siemens Bank 2022,Under the stress scenario the risk-taking  potential is reduced by losses of 54,LOSS
Siemens Bank 2022,Against the backdrop of market movements in the interest   rate FX and refinancing environment the Management  Board takes a critical view of the risk development is how - ever satisfied overall with the development of internal capital  adequacy in the past fiscal year,INTEREST
Siemens Bank 2022,In particular the risk capital  requirement for credit risk increased at a slightly slower pace  than growth in the lending portfolio and the other impacts  from geopolitical changes supply chain disruptions and mar - ket price fluctuations on internal capital adequacy remain  manageable,CREDIT
Siemens Bank 2022,The risk-taking potential in a stress scenario results from the  risk-taking potential less additional losses in the stress sce- nario,LOSS
Siemens Bank 2022,Starting with the 20212022 fiscal year prepay - ment risk is no longer considered within the internal capital  adequacy as in total economic losses due to the early   termination of loan agreements no longer occur and the   early termination of refinancing agreements is no longer   necessary due to improved operational management,LOSS
Siemens Bank 2022,The capital requirements for default risk  market risk and operational risk are determined using the  regulatory approaches,REGULATORY
Siemens Bank 2022,The stress tests are aligned with the objectives and  action plans defined in the business and risk strategies as  well as the regulatory requirements in MaRisk,REGULATORY
Siemens Bank 2022,As of September 30 2022 the composition of regulatory  capital at Siemens Bank was as follows  million 2022 2021 Tier 1 Capital Paid-up capital instruments 5,REGULATORY
Siemens Bank 2022,Default risk Standardized credit risk approach Central governments 0,CREDIT
Siemens Bank 2022,The total capital ratio also includes the  capital preservation buffer and the anti-cyclical buffer which  must be furnished from common equity tier 1 capital,EQUITY
Siemens Bank 2022,The  total capital ratio is the ratio of the total amount from risk- weighted assets to Siemens Banks regulatory capital,REGULATORY
Siemens Bank 2022,As Siemens Banks equity comprises  predominantly tier 1 capital components the total capital  ratio is only slightly higher than the tier 1 capital ratio   Pillar I of 11,EQUITY
Siemens Bank 2022,Both ratios are therefore higher than the capital  ratios specified by the regulatory requirements,REGULATORY
Siemens Bank 2022,The difference between the required regulatory capital of  697,REGULATORY
Siemens Bank 2022,Within default risk overall Siemens Bank makes a dis- tinction between credit risk counterparty risk and issuer risk,CREDIT
Siemens Bank 2022,The framework of rules and regulations for identifying man- aging and monitoring default risk comprises the Credit Policy  and its associated guidelines for default risk management,CREDIT
Siemens Bank 2022,The Credit Policy is a comprehensive description of proce- dures tools roles and responsibilities for all persons involved  in the process,CREDIT
Siemens Bank 2022,Credit risk Credit risk refers to the risk that a borrower will fail to meet  its obligations to Siemens Bank under a loan agreement  either partially or in full,CREDIT
Siemens Bank 2022,Credit risk also includes transaction  risk under loan agreements the risk of default in connection  with deposits made by Siemens Bank and country risk,DEPOSIT
Siemens Bank 2022,Coun- try risk is the risk of constraints on monetary transfers or cur - rency conversions as a result of official decisions or political  restrictions in a particular country,RESTRICTIONS
Siemens Bank 2022,the credit risk in relation to governments  or central banks,CREDIT
Siemens Bank 2022,Credit risk is the principal form of default  risk to which Siemens Bank is exposed,CREDIT
Siemens Bank 2022,Issuer risk Issuer risk is the risk of deterioration in the credit rating of an  issuer or the risk that an issuer will default either partially  or in full,CREDIT
Siemens Bank 2022,On September 30 2022 Siemens Bank was only  exposed to issuer risk positions through short-term bonds  treasury bills with maturities of less than one year,BONDS
Siemens Bank 2022,Siemens Bank has a num- ber of rating procedures at its disposal for determining cus- tomer credit ratings,CREDIT
Siemens Bank 2022,Siemens Bank has defined ten rating classes to enable it to  achieve a meaningful differentiation between credit ratings,CREDIT
Siemens Bank 2022,This system therefore consists of a  total of 19 different credit rating categories overall,CREDIT
Siemens Bank 2022,The rat- ing categories can be reconciled with external credit ratings  using a conversion table,CREDIT
Siemens Bank 2022,If credit ratings are available from  an external provider in any particular instance these external  ratings can be used as an input for a credit rating procedure,CREDIT
Siemens Bank 2022,All external credit ratings used by the Bank in its risk classi- fication procedures are obtained exclusively from SP Fitch  or Moodys,CREDIT
Siemens Bank 2022,Even if an external credit rating is used Siemens   Bank still carries out a credit rating analysis using its own  knowledge and information,CREDIT
Siemens Bank 2022,Credit rating classes 1 to 7 are  used for unproblematic customers,CREDIT
Siemens Bank 2022,If a borrower is classified with a credit rating of 8 or worse  the borrower concerned is made subject to intensified obligor  management,CREDIT
Siemens Bank 2022,If a borrower is classified with a  credit rating of 9 or worse the borrower concerned is trans- ferred to the problem obligor management unit,CREDIT
Siemens Bank 2022,The credit rating  for a borrower must always be considered in relation to the  rating for the borrowers country and is generally subject to  an upper limit based on the country risk,CREDIT
Siemens Bank 2022,A borrowers credit rating is reviewed at least once a year on  the basis of the latest available information,CREDIT
Siemens Bank 2022,Credit ratings  are reviewed immediately if there are changes in specific bor - rower circumstances or significant changes in the economic  environment,CREDIT
Siemens Bank 2022,Expected loss To determine the expected loss the Bank forecasts the aver - age loss it expects based on the current credit rating and the  current expected recovery rate for each and every borrower,LOSS
Siemens Bank 2022,The expected loss is a key figure in portfolio analysis and a  key input variable for pricing new business,LOSS
Siemens Bank 2022,When determin- ing risk as part of the portfolio analysis the expected loss is  calculated for a period of one year the maturity of the expo- sure is used for the purpose of pricing new business,LOSS
Siemens Bank 2022,Unexpected loss A credit-value-at-risk approach is used to analyze lending  portfolio risk and to determine the economic capital require- ment,LOSS
Siemens Bank 2022,The credit value at risk serves to quantify an unex- pected loss and is a key risk variable in portfolio modeling,LOSS
Siemens Bank 2022,Credit  risk modeling at the portfolio level uses a simulation-based  asset-value model,CREDIT
Siemens Bank 2022,Custom- ers with similar economic characteristics are aggregated into  risk units in order to calculate the unexpected loss,LOSS
Siemens Bank 2022,A loss distribu- tion for the lending portfolio is generated from the result- ing changes in the probability of default,LOSS
Siemens Bank 2022,In addition to the  correlations of the risk units another key input variable for  the Monte Carlo simulation is the probability of a credit rat- ing migration,CREDIT
Siemens Bank 2022,To obtain this data the Bank draws up a table  based on historical credit rating migrations,CREDIT
Siemens Bank 2022,The simulated loss distribution takes into account  not only losses due to a migration to a default class but also  economic losses by a risk unit caused as a result of the deteri- oration in credit rating,LOSS
Siemens Bank 2022,The exposure for a risk unit comprises  the loan amount paid out and any weighted amount related  to open external credit lines,CREDIT
Siemens Bank 2022,In addition to losses due to rat- ing migration the portfolio model also takes into consider - ation fluctuations of the recovery rate and asset recoveries,LOSS
