Bank Name,Financial Text,Financial Term
Siemens Bank 2022,Based on the existing  profit-and-loss transfer agreement with Siemens AG this income is not subject to the dividend  payout restriction,PROFIT
Siemens Bank 2022,In the context of determining the liabilities from the deferred compensa- tion scheme Siemens Bank exercised a lock-in option for accrued profits,PROFIT
Siemens Bank 2022,Under these guarantee credit facilities Siemens   Bank must make payments to the beneficiary if the Siemens Bank customer fails to meet its  obligations,CREDIT
Siemens Bank 2022,Siemens Bank grants irrevocable loan commitments as part of project finance or lines of credit  in order to satisfy the financing needs of its customers,CREDIT
Siemens Bank 2022,These accounting groups were used in the previous year to hedge valuation effects from  interest-rate risks amounting to 577 thousand current fiscal year 0 thousand,INTEREST
Siemens Bank 2022,The effec- tiveness of the accounting group is always evidenced by a comparison of the interest-induced  changes in market value,INTEREST
Siemens Bank 2022,For short-term interest rate swap transactions OTC not included in an accounting group  Siemens Bank allocated provisions for onerous contracts in the amount of 74 thousand in the  previous year which were also reported under other provisions as a component of the provi- sions for year-end costs and were reversed in the 2022 fiscal year,INTEREST
Siemens Bank 2022,The identification of impaired loans and advances to  customers and the assessment based on this of any neces- sary specific loan loss provisions is a key area in which man- agement makes discretionary decisions,LOSS
Siemens Bank 2022,Minor changes in the assumptions may lead to significant  changes in measurement which may lead to a change in the  need for loan loss provisions particularly in the case of loans  and advances to customers who are exposed to sustained  negative market conditions,LOSS
Siemens Bank 2022,As part of the audit we determined the identification and  measurement of impaired loans and advances to custom- ers as a key audit matter because loans and advances to  customers account for a very high proportion of the balance  sheet total of Siemens Bank GmbH and the assessment of the  recoverability of loans and advances to customers and the  appropriate recognition of specific loan loss provisions are to  a large extent based on assessments and assumptions of the  legal representatives,LOSS
Siemens Bank 2022,The focus here was  on the processes for calculating impairment losses including  the assessment of collateral the rating processes and the  process of analyzing information on the financial position of  borrowers,LOSS
Siemens Bank 2022,In addition we performed audit procedures relating to spe- cific declarations on the basis of a risk-oriented selection and  of a supplementary sample check and assessed the appro- priateness of the calculation of the specific loan loss provi- sions,LOSS
Siemens Bank 2022,In detail we retraced the key assumptions in the context of  the process of determining loan loss provisions,LOSS
Siemens Bank 2022,Frankfurt am Main December 8 2022  BDO AG Wirtschaftsprfungsgesellschaft   signed Curt  signed Schmiederer  Wirtschaftsprferin  Wirtschaftsprfer   German public auditor German public auditor Independent Auditors Report 63 Annual Report 2022  Siemens Bank Disclosures pursuant to  section 26a 1 2 and 4  of the German Banking  Act KWG 64 Siemens Bank   Annual Report  2022 translation of the German originalDisclosures pursuant to section  26a 1 2 and 4 of the German  Banking Act KWG Notes to the annual financial statements of Siemens Bank GmbH Munich   for the fiscal year from October 1 2021 to September 30 2022 Siemens Bank maintained the following branches in member states of the European Union as  of September 30 2022  Germany Siemens Bank GmbH Otto-Hahn-Ring 6 81739 Munich head office  As of September 30 2022 Siemens Bank had two branch offices in countries outside the  European Union  United Kingdom Siemens Bank GmbH London Branch 111 Old Broad Street London   EC2N 1AP  Singapore Siemens Bank GmbH Singapore Branch 60 MacPherson Road Singapore  348615 The consolidated breakdown of operations at these branches is as follows Germany United Kingdom Singapore  000 2022 2021 2022 2021 2022 2021 Business type Lending and   guarantee business   Deposit business   Fee businessLending and   guarantee business   Fee businessLending and   guarantee business   Fee business Figures Sales revenue  124352 70479 56226 67242 49840 62443 Profit before tax  -339642 11850 87080 43089 285583 23359 Taxes on profit  -320 -172 -6660 -8807 -4938 -3265 Government assistance received  0 0 0 0 0 0 Number of employees on payroll 206,REVENUE
Siemens Bank 2022,Return on investment pursuant to section 26a 1 4 KWG was 0,INVESTMENT
