Bank Name,Financial Text,Financial Term
DZ Bank,The principal sources of income were service fees in the Corporate Banking business line in particular from  lending business including gu arantees and international business in the Capital Markets business line mainly  from securities issuance and brokerage business agents fees transactions on futures and options exchanges  financial services and the provision of information and in t he Transaction Banking business line primarily  from payments processing including credit card processing safe custody and gainslosses from the currency  service business,LOSS
DZ Bank,Gains and losses on trading activities  amounted to a net gain of 584  million first half of 2022 net gain  of 347  million,LOSS
DZ Bank,Gains and losses on trading activities reflect the business activity of the Capital Markets business line and gains  and losses  on money market business entered into for trading purposes mainly repurchase agreements and  on derivatives of the Group Treasury division financial assets and liabilities measured at fair value through  profit or loss fair value PL,PROFIT
DZ Bank,The fair value gains and losses on financial assets and liabilities designated as at  fair value through profit or loss fair value option are  apart from credit rating effects  also included in gains  and losses on trading activities,PROFIT
DZ Bank,The credit -rating -related effects pertaining to these financial instruments are  included in other gains and losses on valuation of financial instruments if the instruments are financial assets  or in equity if the instruments are financial liabilities,LOSS
DZ Bank,Gains and losses on operating trading  activities in the Capital Markets business line amounted to a net gain   of 369  million compared with 207  million in the prior -year period,LOSS
DZ Bank,Gains and losses on operating trading activities in the first half of 2023 were influenced by a more favorable  capital market environment than in the prior -year period,LOSS
DZ Bank,As had also been the case in the first six months of 2022 IFRS -related effects made a positive contribut ion to  gains and losses on trading activities during the reporting period,LOSS
DZ Bank,One of the key factors in this context was  changes in the fair value gains and losses relating to own issues including pull -to-par effects in the fair value  PL and fair value op tion subcategories which were higher overall than in the first half of 2022,LOSS
DZ Bank,Gains and losses on investments  came to a net loss of 1  million and were therefore unchanged on the  first half of 2022,LOSS
DZ Bank,The net loss in the reporting period resulted from expenses of 95  million from the sale of  securities in the category fair value through other comprehensive income  combined with gains of 91  million  arising from the unwinding of hedges accounted for in the category fair value through other comprehensive  income in the context of portfolio fair value hedge accounting,LOSS
DZ Bank,Securities in the category fair value through  profit or loss generated a net gain of 3  million,PROFIT
DZ Bank,Other gains and losses on valuation of financial instruments  declined to a net loss of 91  million first  half of 2022 net loss of 6  million,LOSS
DZ Bank,Within this figure credit -risk-related measurement effects relating to  financial assets measured using the fair value option declined by 75  million to a net loss of 53  million first  half of 2022 net gain of 21  million and the net loss from ineffectiveness in hedge accounting increased by  24 million to 41  million first half of 2022 net loss of 17  million,LOSS
DZ Bank,Conversely the valuation of financial  instruments measured at fair value through profit or loss improved by 17  million to a net gain of 7  million  first half of 2022 net loss of 10  million,PROFIT
DZ Bank,Overall loss allowances amounted to a net reversal of 36  million first half of 2022 net addition of  44 million,LOSS
DZ Bank,The net additions in respect of the lending business and investments totaled 1  million first half  of 2022 net additions of 61  million,INVESTMENT
DZ Bank,Within this figure there were net reversals of 27  million related to loss  allowances in stage 1 first half o f 2022 net reversals of 3  million net reversals of 14  million related to loss  allowances in stage 2 first half of 2022 net additions of 60 million and net additions of 42  million related  to loss allowances in stage 3 first half of 2022 net a dditions of 4  million,LOSS
DZ Bank,The net reversal in respect of  recoveries on loans and advances previously impaired directly recognized impairment losses other gains and  losses on purchased or originated credit -impaired assets POCI assets and additions to ot her provisions for  loans and advances was 37  million first half of 2022 net reversal of 17  million,LOSS
DZ Bank,Furthermore loss allowances were increased in stage 3 owing to  additions in respect of individual counterparties owing to changes in credit ratings,LOSS
DZ Bank,These were partly offset   by reversals as a result of improvements in the credit ratings of some coun terparties,CREDIT
DZ Bank,Staff expenses rose by 23  million to 319  million first half of 2022 296  million owing to increases in  wages and salaries and in the asso ciated expenses for social security,SECURITY
DZ Bank,The  breakdown of these charges was as follows depreciation of right -of-use assets 14  million first half of 2022  15 million depreciation of property plant and equipmen t and investment property 12  million first half of  2022 15  million and amortization of other intangible assets 10  million first half of 2022 8  million,INVESTMENT
DZ Bank,Profit before taxes  amounted to 697  million in the reporting period which was  328 million higher than  the figure of 369  million reported for the comparative period,PROFIT
DZ Bank,This change largely related to the lower level of early redemption payments  received in the first ha lf of 2023 which amounted to 1  million first half of 2022 31  million and bonus  interest of 7  million in the prior -year period resulting from DZ  HYPs participation in the ECBs TLTRO III  program there was no such bonus interest in the reporting pe riod,INTEREST
DZ Bank,The volume of real estate loans which is the main driver of net interest income stood at 56771  million as   at June 30 2023 December 31 2022 56686  million,INTEREST
DZ Bank,Gains and losses on investments deteriorated t o 0 million first half of 2022 net gain of 33  million,LOSS
DZ Bank,The net gain for the first half of 2022 included income of 30  million resulting from the sale of Portuguese  government bonds,BONDS
DZ Bank,The net gain under other gains and losses on valuation of financial  instruments  declined by 46  million  to 27  million first half of 2022 73  million,LOSS
DZ Bank,The main influence on this figure was the movement of credit  spreads,CREDIT
DZ Bank,For example the gains and losses on valuation of bonds from the peripheral countries of the  eurozo ne amounted to a net gain of 15  million in the six months under review first half of 2022 net gain   of 44  million,LOSS
DZ Bank,Loss allowances amounted to a net addition of 20  million first half of 2022 net addition of 14  million,LOSS
DZ Bank,In the prior -year period the main influence on loss allowances had been due to adjustments to the model - driven calculation,LOSS
DZ Bank,Profit before taxes  fell to 212  million first half of 2022 335  million,PROFIT
DZ Bank,This improvement was mainly attributable to higher income in the lending and money market businesses due  to the changed interest -rate regime and market opportunities being seized in liquidity management,INTEREST
DZ Bank,As at June 30 2023 high -net-worth individuals assets under management which comprise the volume of  securities derivatives and deposits of customers in the private banking business amounted to 22,DEPOSIT
DZ Bank,The value of funds under management amounted to 178,FUNDS
DZ Bank,This year -on-year rise w as  essentially due to increased regulatory contributions and higher costs for IT and consultancy,REGULATORY
DZ Bank,Profit before taxes climbed to 53  million first half of 2022 19  million,PROFIT
DZ Bank,The  increase in net interest income was mainly due to a slight year -on-year rise in the lending and object finance  portfolio volume to 2985  million June 30 2022 2944  million and higher net  margins,INTEREST
DZ Bank,Loss allowances amounted to a net addition of 12  million in the period under review first half of 2022 net  addition of 3  million,LOSS
DZ Bank,The increased expenses were mainly due to the rise in defaults in respect of VR Smart  flexibel and VR Smart express and to large addi tions to loss allowances in stages 1 and 2,LOSS
DZ Bank,It also  contains the net interest incomeexpense from the funding of liquidity from the balance of non -interest - bearing assets and liabilities,INTEREST
DZ Bank,Net interest income amounted to a net expense of 55  million in t he period under review first half of 2022  net expense of 9  million,INTEREST
DZ Bank,The net interest expense on purchased and issued subordinated capital and senior non -preferred paper  increased by 19  million to 36  million first half of 2022 17  million,INTEREST
DZ Bank,The ne t interest expense from the funding of liquidity from the balance  of non -interest -bearing assets and  liabilities amounted to 19  million in the period under review first half of 2022 net interest income of  8 million,INTEREST
DZ Bank,The deterioration was due to high er market interest rates in the short -dated segment,INTEREST
DZ Bank,The adjustments to net interest income were primarily the result of the elimination of intragroup dividend  payments and profit distributions in connection with intragroup liabilities to dormant partners and were also  attributable to the early redemption of issued bonds and commercial paper that had been acquired by entities  in the DZ  BANK Group other than the issuer,PROFIT
DZ Bank,Internal transactions in the DZ  BANK   CICB operating segment  were also eliminat ed in net interest income and with offsetting entries under gains and losses on trading  activities,LOSS
DZ Bank,Within this amount derivatives positive fair values stood at 18850  million December 31 2022  21474  million bonds and other fixed -income securities at 9661  million December 31 2022  7729  million shares and other variable -yield securities at 1386  million December 31 2022  1388  million receivables at 78 93 million December 31 2022 18318  million money market  placements at 6868  million December 31 2022 17058  million and promissory notes and registered  bonds at 1025  million December 31 2022 1259  million,BONDS
DZ Bank,Investments increased by 331 7 million to 46710  million December 31 2022 43393  million,INVESTMENT
DZ Bank,The main  reasons for this change were an increase of 2594  million in bonds and other fixed -income securities to  43325  million December 31 2022 40731  million and an increase of 72 9 million in shares and other  variable -yield securities to 2691  million December 31 2022 1962  million,BONDS
DZ Bank,Investments held by insurance companies grew by 5658  million to 111206  million December 31 2022   105548  million,INVESTMENT
DZ Bank,The overall increase was partly offset by in particular a  188  million decrease in derivatives positi ve fair values to 90  million December 31 2022 278  million   and a 60  million decrease in registered bonds to 5370  million December 31 2022 5430  million,BONDS
DZ Bank,Deposits from banks  as at December 31 2022 amounted to 181505  million which was 52 82 million  lower than the figure reported as at December 31 2022 of 186787  million,DEPOSIT
DZ Bank,Deposits from domestic banks  went down by 13093  million to 157619  million December 31 2022 170712  million whereas deposits      27 DZ BANK   2023 Half -Year Financial Report   Interim group management report   Business report   from foreign banks rose by 781 1 million to 23886  million December 31 2022 16075  million,DEPOSIT
DZ Bank,Deposits from customers  grew  by 4962  million to 164391  million December 31 2022 159429  million,DEPOSIT
DZ Bank,Deposits from domestic customers grew by 6317  million to 135996  million December 31 2022  129679  million,DEPOSIT
DZ Bank,By contrast deposits from foreign customers shrank by 1355  million to 28395  million  December 31 2022 29750  million,DEPOSIT
DZ Bank,At the end of the reporting period the carrying amount of debt certificates issued including bonds    was 100053  million December 31 2022 82349  million predominantly because of increas ed issues   of mortgage Pfandbriefe and a rise in commercial paper,BONDS
DZ Bank,Within the total figure bonds issued came to  80062  million December 31 2022 68271  million while the portfolio of other debt certificates stood  at 19991  million December 31 2022 14077  million,BONDS
DZ Bank,However  deposits rose by 2468  million bonds issued by 1568  million and short positions by 1077  million,DEPOSIT
DZ Bank,This was predominan tly due to the 4816  million rise in the liability for remaining coverage  to 90805  million December 31 2022 85989  million combined with a fall of 226  million in the liability  for incurred claims to 11433  million December 31 2022 11659  million,LIABILITY
DZ Bank,As at June 30 2023 equity had advanced by 2768  million to 30877  million December 31 2022  28109  million,EQUITY
DZ Bank,The increase was mainly due to growth of 1545  million in retained earnings to  16301  million December 31 2022 14756  million and to the rise in additional equity components to  3293  million December 31 2022 2150  million resulting from the issue of a tranche of additional Tier 1  notes AT1 bonds in a total volume of 1143  million,BONDS
DZ Bank,Moreover the rapid interest -rate increases have  swiftly become reflected in banks new lending business which has led to a slowdown in mortgage finance   in particular,INTEREST
DZ Bank,However high interest rates are weighing not only on investment in construction which is  simultaneously being hit by sharply rising costs but also on companies spending on capital equipment,INVESTMENT
DZ Bank,A further unexpected rise in interest rates would put  additional pressure on the economy as would further escalation of the war in Ukraine or a renewed flare -up  of the energy crisis,INTEREST
DZ Bank,High interest rates  and still significantly elevated inflation are key factors that  point to a looming economic downturn,INTEREST
DZ Bank,Consumers are likely to become increasingly reluctant to spend and  companies will scale back their investment activities,INVESTMENT
DZ Bank,In light of weak demand at an international level and high interest rates the outlook for the  industrial and construction sectors remains gloomy,INTEREST
DZ Bank,In particular p roduction restrictions in the energy -intensive   industrial sector acted as a brake on economic growth,RESTRICTIONS
DZ Bank,However demand for property which had previously been  fueled by historically low financing rates and capital market yields suddenly slumped in the second quarter of  2022 owing to higher interest rates,INTEREST
DZ Bank,Rising interest rates and stricter financing conditions  are also taking their toll on the economy,INTEREST
DZ Bank,In mid -2022 the US Federal Reserve began to trim down its balance sheet by reducing the exposures built up  under its asset purchase program and started to raise the federal funds rate which now stands at 5,FUNDS
DZ Bank,Alongside these measures   the ECB decided to continue raising its key interest rates at a moderate pace whic h meant that the main   refinancing rate reached 4  percent by the end of June 2023 and 4,INTEREST
DZ Bank,The current cyc le  of interest -rate increases which remains unparalleled in the history of the ECB in terms of duration and pace  highlights the determination of the central bank to  bring inflation back down to the long -term target level   of 2 percent,INTEREST
DZ Bank,Nonetheless a substantial further  increase in interest rates is regarded as unlikely,INTEREST
DZ Bank,The overall rise in interest rates should continue to provide a tailwind for interest -driven business in the  financial sector which in turn should have a positive effect on overall earnings,INTEREST
DZ Bank,However the rise in interest  rates is also putting mounting pre ssure on the property market,INTEREST
DZ Bank,The extent to which higher financing costs may trigger price  corrections that necessitate the recognition of impairment losses on real estate assets will need to be monitored   on an ongoing basis,LOSS
DZ Bank,There are lingering concerns that a rapid and sustained rise in interest  rates could undermine the confidence  of investors in US regional banks which typically have a high level of exposure to commercial real estate,INTEREST
DZ Bank,According to the current forecast net interest income including net income from long -term equity investments   will increase slightly in 2023 from its already high level,INVESTMENT
DZ Bank,Net interest income is expected to be stabilized by the  forecast growth in the interest -bearing business especially in the operating segments in the DZ  BANK Group  that are sensitive to interest rates,INTEREST
DZ Bank,Gains and losses on trading activities are expected to deteriorate substantially following exceptionally high   net gains in 2022,LOSS
DZ Bank,This is because positive valuation effects that had bolstered gains and losses on trading  activities in the previous year will not be repeated in 2023,LOSS
DZ Bank,Gains and losses on investments are anticipated to improve considerably to a net gain in 2023 partly because  the figure for 2022 was depressed by sales of investments and other factors as mentioned in the 2022 group  management report,LOSS
DZ Bank,In relation to the  RV segment this forecast is mainly based on the projected normalization of gains and losses on investments  held by insurance companies and thus a  substantial year -on-year improvement,LOSS
DZ Bank,Expenses for loss allowances are still expected to go up significantly in the reporting year partly due to new  business and other factors not taken into account in the existing parameter -based loss allowances,LOSS
DZ Bank,Profit before taxes in 2023 is predicted to be  up significantly compared with 2022 even though macroeconomic   conditions look set to remain challenging,PROFIT
DZ Bank,Regulatory RORAC the risk -adjusted performance measure based on regulatory risk capital will probably rise  appreciably this year compared with 2022 owing to the high level of profit before taxes,PROFIT
DZ Bank,As matters currently stand the DZ  BANK Groups capital adequacy will continue to be assured for the second  half of 2023 from both economic and regulatory perspectives that is to say it will continue to have at its  disposal the available internal capital and regulatory own funds necessary  to cover the risks associated with  the finance business and other risks arising from the groups business operations,FUNDS
DZ Bank,Under the continuing ass umption of moderate  wage increases despite the remarkable stability of labor markets to date the major central banks could  potentially conclude their cycle of interest -rate hikes in 2023 and leave key interest rates at a sufficiently high  level that real interest rates become restrictive,INTEREST
DZ Bank,Moreover the DZ  BANK Groups financial performance would benefit if the real estate markets  managed to weather the current high interest -rate environment without significant price corrections,INTEREST
DZ Bank,In particular an assumed  economic recovery could potentially limit the net expense recognized for loss allowances and thereby help to   increase the Groups net profit,PROFIT
DZ Bank,For example sustainability aspects are  becoming increasingly important for many c ustomers when making purchases and investments,INVESTMENT
DZ Bank,This would have a  positive impact on for example net fee and commission income and net interest income,INTEREST
DZ Bank,Secondly the entities in the DZ  BANK Group have jointly identified key areas of collaboration such as  operating models and sustainability that offer potential to reinforce their future viability and profitability,PROFIT
DZ Bank,This should also help to further  optimize the banks streamlined profitable approach incorporating intensive customer relationship  management,PROFIT
DZ Bank,Its strategic program WIRRV is designed to boost  earnings power by putting a greater emphasi s on profitability so that it can continue to make a significant  contribution to the success of business in the cooperative financial network,PROFIT
DZ Bank,Positive effects from the strategic programs and initiatives could have a beneficial impact on for example net fee  and commission income net interest income or administrative expenses,INTEREST
DZ Bank,The DZ  BANK Group has a risk management system  that is updated on an ongoing basis in line with changes  to the business and regulatory environment,REGULATORY
DZ Bank,In addition changes in credit ratings and correlations affect the modeled level of  credit risk,CREDIT
DZ Bank,The key risk management figures used in respect of  capital  are economic capital adequacy the coverage ratio for the financial conglomerate and the regulatory  capital ratios plus the leverage ratio the ratios for the minimum requirement for own funds and eligible liabilities  MREL and the subordinated MREL r atios,FUNDS
DZ Bank,Furthermore policyholders have a share in any gains or losses from investments in  connection with life i nsurance as specified in statutory requirements and this must be appropriately taken into  account in the measurement of risk,LOSS
DZ Bank,Not least the superviso ry authorities also treat banking business and  insurance business differently and this is reflected in differing regulatory regimes for banks and insurance  companies,REGULATORY
DZ Bank,This means that it is no longer necessary to comply  with the regulatory liquidity requirements at the level of the two individual institutions,REGULATORY
DZ Bank,DZ HYP has applied the capital waiver  pursuant to section 2a 1 2 and 5 of the German Banking Act  KWG in conjunction with article 7 1 CRR under which  provided certain conditions are met  regulatory  supervision at individual bank level may be replaced by supervision of the entir e banking group,REGULATORY
DZ Bank,The other subsidiaries and  investee entities of DZ  BANK are integrated into the risk management system either indirectly as part of equity  investment risk or directly as part of other types of risk,INVESTMENT
DZ Bank,With the entry into effect of IFRS 17 previous standard IFRS  4 on January  1 2023 the accounting treatment of  insurance contracts in particular the treatment of liabilities to policyholders recognized under equity and  liabilities has been changed at RV,EQUITY
DZ Bank,This led to a t emporary technical interest -rate risk caused by  the strong increase in interest rates in 2022,INTEREST
DZ Bank,The result was a negative contribution to earnings and  consequently a decrease in common equity Tier 1 capital at the level of the DZ  BANK banking group as at  December 31 2022,EQUITY
DZ Bank,The first regulatory key figures affected by the transition to IFRS  17 were those reported as at  June 30 2023 as these figures are typically based on the most recent adopted annual financial statements or  audited interim financial statements,REGULATORY
DZ Bank,As at the reporting date DZ  BANK had permission from the European  Central Bank ECB to include its interim profit and by extension further dynamic equity components,PROFIT
DZ Bank,The coverage ratio for the  DZ BANK financial conglomerate and economic capital adequacy are based on the provisions of Solvency  II  meaning that both assets and equity and liabilities are already measured at fair value,EQUITY
DZ Bank,They also complied with regulatory requirements for liquidity adequacy,REGULATORY
DZ Bank,The DZ  BANK Group remained within its economic risk-bearing capacity  in the first half of 2023 and also  complied with regulatory requirements for capital adequacy on every reporting date,REGULATORY
DZ Bank,Regulatory risk factors  Regulatory capital buffers not adhered to     Macroeconomic risk factors    Further escalation of the war in Ukraine energy shortages    A further unexpected rise in interest rates    Inflation  stagflation    Correction in real estate markets    Economic policy divergence in the eurozone     In the first half of 2023 there were no rating downgrades for DZ  BANK,INTEREST
DZ Bank,Most of the outstanding transactions and contracts referencing US dollar Libor as well as measurement and risk  calculation methods have been amended by DZ  BANK as planned and in keeping with relevant deadlines so that  they use SOFR -based interest rates and yield curves instead,INTEREST
DZ Bank,Certain individual contracts will be switched over  after June 30 2023 but before the end of the current interest period in which th e interest rate is still based on  US dollar Libor or alternatively with the help of the synthetic US  dollar Libor,INTEREST
DZ Bank,The US reiterated its security guarantees for Taiwan in response to a more aggressive  stance from the Chinese government and a series of military maneuvers,SECURITY
DZ Bank,Although they currently appear to be contained within these regions they  intersect with geostrategic interests of other countries and in unfavorable circumstances could potentially  spread to other regions,INTEREST
DZ Bank,Any  escalation would directly affect the interests of the superpowers China and the US and could potenti ally widen  into a conflict with global consequences,INTEREST
