Bank Name,Financial Text,Financial Term
DZ Bank,Class according to  IFRS 13   Assetsliabilities   Fair value    million   Risk category   Sensitivity   reference value   Valuation   technique   Aggregate  sensitivity    million   Loans and  advances to  customers    Loans   12  Impairment   Absolute amount   impairment   Present value for  which loss  allowances have  been recognized   -   Receivables arising from silent  partnerships   52  Impairment   Absolute amount   impairment   Mark -to-model  DCF   -1   Profit -participation certificates and  promissory notes   427  Fair value  adjustments   Absolute amount  fair value  adjustment   Mark -to-model  DCF   3   Profit -participation certificates and  promissory notes   26  Impairment   Absolute amount  impairment   Mark -to-model  DCF   -   Shareholders loans   101  Impairment   Absolute amount  impairment   Mark -to-model  DCF   -2   Initial fund loans   14  Probability of  default   Shift of 1 basis  point   Mark -to-model  DCF   -  Derivatives used  for hedging  positive fair  values    Derivatives   7  Yield curves   Shift of 1 basis  point   Mark -to-model  other   -  Financial assets  held for trading    Equitycommodity basket products   4  Equity prices   Shift of 1 in  relation to fair  value   Mark -to-market   -        Fair value  adjustments   Absolute amount  fair value  adjustment   Mark -to-model  other   91       Volatilities log - normal   Shift of 1  percentage point   Mark -to-model  other   -107   Derivatives   956  Volatilities normal   Shift of 1 basis  point   Mark -to-model  other   12   Derivatives   3  Mean reversion   Shift of 1 basis  point   Mark -to-model  other   -   Profit -participation certificates and  promissory notes   270  Fair value  adjustments   Absolute amount  fair value  adjustment   Mark -to-model  DCF   -    Bonds   304  Illiquid market  prices   Shift of 1 in  relation to fair  value   Mark -to-model  DCF   145   Purchase option on investments in  companies   1  Discount rate for  investments in  companies   Shift of 1  percentage point   Mark -to-model  other   -    130  DZ BA NK   2023 Half -Year Financial Report   Interim consolidated financial statements   Notes                      Class according to  IFRS 13   Assetsliabilities   Fair value    million   Risk category   Sensitivity   reference value   Valuation   technique   Aggregate  sensitivity    million   Investments   ABSs   2  ABS spreads   Shift of 1 basis  point   Mark -to-model  DCF   -   ABSs   218  Duration   Shift of 1 year   Mark -to-model  other   -14   Investments in joint   ventures   6  Discount rate for  investments in  companies   Shift of 1  percentage point   Income  capitalization  approach   -   Investments in subsidiaries   1  Dividend estimate   Shift of 1  percentage point   Mark -to-model  DCF   -   Investments in subsidiaries   55  Yield curves   Shift of 1 basis  point   Mark -to-model  DCF   -   Investments in subsidiaries   9  Yield curves   Shift of 1 basis  point   Net asset value   -    Investments in subsidiaries   167  Discount rate for  investments in  companies   Shift of 1  percentage point   Income  capitalization  approach   -4    Investments in subsidiaries   1  Equity prices   Shift of 1 in  relation to fair  value   Net asset value   -    Bearer securities   869  Illiquid market  prices   Shift of 1 in  relation to fair  value   Mark -to-market   8   Investment fund units   9  Yield curves   Shift of 1 basis  point   Net asset value   -        Illiquid market  prices   Shift of 1 in  relation to fair  value   Mark -to-model  other   -    Investment fund units   17  Fair value  adjustments   Absolute amount  fair value  adjustment   Mark -to-model  other   7        Illiquid market  prices   Shift of 1 in  relation to fair  value   Mark -to-model  DCF   670    Bonds   1090   Fair value  adjustments   Absolute amount  fair value  adjustment   Mark -to-model  DCF   1    Bonds   6  Impairment   Absolute amount  impairment   Present value for  which loss  allowances have  been recognized   -    Other shareholdings   210  Discount rate for  investments in  companies   Shift of 1  percentage point   Income  capitalization  approach   -2   Other shareholdings   200  Dividend estimate   Shift of 1  percentage point   Mark -to-model  DCF   2   Other shareholdings   23  Yield curves   Shift of 1 basis  point   Mark -to-model  DCF   -    Other shareholdings   8  Equity prices   Shift of 1 in  relation to fair  value   Net asset value   -    131  DZ BA NK   2023 Half -Year Financial Report   Interim consolidated financial statements   Notes                      Class according to  IFRS 13   Assetsliabilities    Fair value    million    Risk category   Sensitivity   reference value   Valuation   technique   Aggregate  sensitivity    million   Investments held  by insurance  companies   ABSs   1538       Third -party pricing  information   -   Investments in subsidiaries  associates and joint ventures and  other shareholdings   5370   Equity prices   Shift of 1 in  relation to fair  value   Net asset value   -   Investments in subsidiaries  associates and joint ventures and  other shareholdings   286  Dividend estimate   Shift of 1  percentage point   Income  capitalization  approach   -   Investments in subsidiaries  associates and joint ventures and  other shareholdings   12      Third -party pricing  information   -       Bond spreads   Shift of 1 basis  point   Mark -to-model  DCF   -1   Loans   1751   Yield curves   Shift of 1 basis  point   Mark -to-model  DCF   -1   Fixed -income securities convertible  bonds shares investment fund units  and shares in cooperatives   643      Third -party pricing  information   -   Profit -participation certificates and  promissory notes   269  Bond spreads   Shift of 1 basis  point   Mark -to-model  DCF   -   Initial fund loans   84  Probability of  default   Shift of 1 basis  point   Mark -to-model  DCF   -       Bond spreads   Shift of 1 basis  point   Mark -to-model  DCF   -10   Mortgage loans   11361   Yield curves   Shift of 1 basis  point   Mark -to-model  DCF   -11  Deposits from  customers FVO   Profit -participation certificates and  promissory notes   127  Fair value  adjustments   Absolute amount  fair value  adjustment   Mark -to-model  DCF   5  Debt certificates  issued including  bonds       Illiquid market  prices   Shift of 1 in  relation to fair  value   Mark -to-model  DCF   -394       Fair value  adjustments   Absolute amount  fair value  adjustment   Mark -to-model  DCF   2   Bonds   438  Volatilities log - normal   Shift of 1  percentage point   Mark -to-model  DCF   -1  Derivatives used  for hedging  negative fair  values   Derivatives   3  Yield curves   Shift of 1 basis  point   Mark -to-model  other   -  Financial  liabilities held for  trading       Fair value  adjustments   Absolute amount  fair value  adjustment   Mark -to-model  other   36       Volatilities log - normal   Shift of 1  percentage point   Mark -to-model  other   76   Derivatives   474  Volatilities normal   Shift of 1 basis  point   Mark -to-model  other   -6   Derivatives   7  Mean reversion   Shift of 1 basis  point   Mark -to-model  other   -    Bonds   87  Fair value  adjustments   Absolute amount  fair value  adjustment   Mark -to-model  DCF   2    132  DZ BA NK   2023 Half -Year Financial Report   Interim consolidated financial statements   Notes      Measurements of fair value at Level 3 as at December 31 2022   The following table shows the valuation techniques the unobservable inputs and their spreads used for the  fair value measurements at Level 3 of the fair value hierarchy,PROFIT
DZ Bank,In respect of  equity price s for example a check is carried out of whether the equity was traded in a specified period and  whether the trading volume has exceeded a certain threshold,EQUITY
DZ Bank,For bonds the bid -ask spread and the number  of price contributors are taken into account,BONDS
DZ Bank,The gains or losses are predominantly  included in the line items gains and losses o n trading activities other gains and losses on valuation of financial  instruments and gains and losses on investments held by insurance companies and other insurance company  gains and losses,LOSS
DZ Bank,Based on the sensitivity analysis used in 2022 the values as at  December 31 2022 were as follows   For the fair values of investments held b y insurance companies reported within Level 3 a rise in the interest  rate of 1  percent would have led to the recognition of a 22  million loss in the income statement and a loss of  1089  million under other comprehensive incomeloss,LOSS
DZ Bank,For the fair values of investments held by insurance  companies a worsening in the credit rating of 1  percent would have led to the recognition of a 29  million  loss in the income statement and a loss of 1083  million under other comprehensive incomeloss,LOSS
DZ Bank,In the case of th e fair values of loans and advances to customers a worsening in the credit rating or a rise in  the interest rate of 1  percent would have led to the recognition of a 9  million loss in the income statement,LOSS
DZ Bank,For the fair values of investments there would h ave been a 47  million loss under other comprehensive  incomeloss and a 16  million loss in the income statement,LOSS
DZ Bank,The fair values of bonds without liquid markets that are reported within financial assets held for trading  investments and loans and advanc es to customers were given an individual adjustment spread or were  measured using Bloomberg Valuation Service prices which are observable in the market,INVESTMENT
DZ Bank,All other things  being equal an increase in the pertinent measurement assumptions of 1  percent would have led to the  recognition of a 14  million loss in the income statement and a loss of 3  million under other comprehensive  incomeloss,LOSS
DZ Bank,An alternative assumption about the credit spreads used could have led to a significant change in the fair  values of some of the ABSs reported under financial assets held for trading and under investments,INVESTMENT
DZ Bank,All other  138  DZ BA NK   2023 Half -Year Financial Report   Interim consolidated financial statements   Notes      things being equal an increase of 1  percent in these spreads would have led to the recognition of a 1  million  loss under other comprehensive incomeloss,LOSS
DZ Bank,An alternative assumption about the liquidity spreads used could have led to a significant change in respect of  collateralized loan obligations reported under investments and under financial assets held for trading,INVESTMENT
DZ Bank,Non-performing exposures strategically held investments in subsidiaries an d other shareholdings and  investments in real estate funds whose fair values are calculated using an income capitalization approach or  the net asset value were not included in the sensitivity analysis as at December 31 2022,INVESTMENT
DZ Bank,Financial assets of 3139  million categorized as financial assets measured at fair value through profit or loss  had been reclassified as financial assets measured at fair value through other comprehensive income in 2021,PROFIT
DZ Bank,At the time of reclassificatio n the reclassified assets had an average effective interest rate of 2,INTEREST
DZ Bank,During the reporting period these assets generated interest income of 31  million first half of 2022  42 million,INTEREST
DZ Bank,The breakdown of gains and losses from hedge accounting by type of hedge is as  follows            million   Jan,LOSS
DZ Bank,Credit risk management practices   The rules for recognizing loss allowances are based on the calculation of expected losses in the lending  business on investments on investments held by insurance companies and on other assets,LOSS
DZ Bank,The impairment  rules are applied only to those financial ass ets that are not measured at fair value through profit or loss,PROFIT
DZ Bank,The impairment rules are also applied to    financial guarantee contracts and loan commitments that fall within the scope of IFRS  9 and are not  recognized at fair value through profit or loss    lease receivables and    trade receivables and contract assets pursuant to IFRS  15,PROFIT
DZ Bank,In accordance with IFRS 9  the three -stage approach is used additionally taking POCI assets into account to  determine the expected losses    Stage 1 For financial assets whose credit risk has not increased significantly since initial recognition that  were not credit -impaired upon  initial recognition the 12 -month credit loss is recognized,LOSS
DZ Bank,Interest is  recognized on the basis of the gross carrying amount,INTEREST
DZ Bank,Stage 2 For financial assets whose credit risk has increased significantly since initial recognition but are not  considered cre dit-impaired the loss allowances are determined in the amount of the assets lifetime  expected credit losses,LOSS
DZ Bank,Interest is recognized on the basis of the gross carrying amount,INTEREST
DZ Bank,Stage 3 Financial assets are classified as credit -impaired and thus assigned t o stage 3 if they are deemed to  be in default pursuant to article 178 CRR as operationalized in the DZ  BANK Groups definition of default,CREDIT
DZ Bank,Therefore if the financial assets are in default they are also classified as credit -impaired and  assigned to stage 3,CREDIT
DZ Bank,Here too loss allowances are  recognized in the amount of the lifetime expected credit  losses,LOSS
DZ Bank,Interest income on credit -impaired financial assets is calculated on the amortized cost after loss  allowances using the effective interest method,LOSS
DZ Bank,Credit -impaired financial assets are initially  recognized at fair value rather than at their gross carrying amount,CREDIT
DZ Bank,Consequently interes t is recognized for  these assets using a risk -adjusted effective interest rate,INTEREST
DZ Bank,The review of whether the credit risk of financial assets financial guarantee contracts and loan commitments  has increased significantly since initial recognition is carried out on an ongoing basis,CREDIT
DZ Bank,As a rule quantitative analysis looks at the expected credit risk over the entire residual life of the  financial instruments in question,CREDIT
DZ Bank,The model -driven default probability profiles used in economic and regulatory risk management are  adjusted on the basis of the se shift factors see the section Impact of macroeconomic conditions,REGULATORY
DZ Bank,For the  140  DZ BA NK   2023 Half -Year Financial Report   Interim consolidated financial statements   Notes      quantitative transfer criterion the credit risk as at the balance sheet date for the residual life is compared with  the assets credit risk over the same maturity period esti mated at the time of initial recognition,CREDIT
DZ Bank,The thresholds  that indicate a significant increase in credit risk are determined for each portfolio separately as the ratio of the  latest changes in the lifetime probability of default lifetime PD to the portfol ios past lifetime PD,CREDIT
DZ Bank,Internal risk  measurement systems external credit ratings and risk forecasts are also used to assess the credit risk of  financial assets,CREDIT
DZ Bank,These also have significa ntly increased credit risk and are assigned  to stage 2 unless they need to be assigned to stage 3,CREDIT
DZ Bank,Assets with low credit risk andor an investment -grade credit rating are also monitored for increases in credit risk  and for credit rating changes,INVESTMENT
DZ Bank,If the quantitative transfer thresh old is exceeded however the low credit risk  exemption means that these assets are transferred to stage 2 only if a qualitative transfer criterion applies or if a  non-investment -grade credit rating is awarded,INVESTMENT
DZ Bank,The low credit risk exemption applies to secu rities loans and  advances loan commitments and financial guarantee contracts,CREDIT
DZ Bank,If on the balance sheet date it is found that there is no longer a significant increase in credit risk compared  with previous balance sheet dates the financial assets in qu estion are transferred back to stage 1 and the loss  allowances are brought back down to the level of the 12 -month expected credit loss,LOSS
DZ Bank,If a financial instrument  in stage 3 recovers the difference between the interest income determined for the period of c redit  impairment on the basis of amortized cost and the actual interest income recognized in respect of the  financial instrument for the period concerned is reported as a reversal of an impairment loss or a reversal of  loss allowances,LOSS
DZ Bank,A transfer back from  stage 3 is carried out if there are no longer indicators of credit  impairment,CREDIT
DZ Bank,At the same time the regulatory default status ceases to apply and specified cure periods are  taken into account,REGULATORY
DZ Bank,Expected losses are calculated as the probability -weighted p resent value of the expected outstanding payments,LOSS
DZ Bank,The expected losses are discounted w ith the original  effective interest rate for the transaction and variable -rate assets with the current interest rate,LOSS
DZ Bank,The calculation  uses the regulatory model probability of default loss given default and expected loan amount at the time of  default w ith adjustments to satisfy the requirements of IFRS 9,LOSS
DZ Bank,This is applied when loss allowances are determined in the  form of shifts in the default probabilities cal culated using statistical methods known as shift factors,LOSS
DZ Bank,Depending  on the portfolio the calculation of the expected loss for specific exposures in stage 3 also uses this type of  parameter -based approach or draws on individual expert appraisals of the e xpected cash flows and probability - weighted scenarios at individual transaction level,LOSS
DZ Bank,For the purpose of calculating loss allowances for portfolios the portfolios are grouped according to shared  credit risk characteristics e,LOSS
DZ Bank,credit rating date of or igination residual life industry and origin of the  borrower and type of asset,CREDIT
DZ Bank,Directly recognized impairment losses reduce the carrying amounts of assets directly,LOSS
DZ Bank,Unlike loss allowances  which are estimates directly recognized impairment losses are s pecified in an exact amount if this is justified  because the receivable is not collectible e,LOSS
DZ Bank,Impairment  losses can be recognized directly by writing down the asset value andor by using existing loss allowances,LOSS
DZ Bank,Directly recognized impairment losses are also applied to immaterial amounts,LOSS
DZ Bank,The contribution for the Austria portfolio has also been reduced as a new sales  scorecard has been used for new business in this portfolio since March 2023 and provides a better picture of  credit risk,CREDIT
DZ Bank,It is also evident that the effects of group contagion in the definition of default have an only  immaterial impact on credit risk,CREDIT
DZ Bank,Overall the updating of the post -model adjustments resulted in a reduction in loss allowances of  33 million recognized in profit or loss and thus taking account of portfolio growth and an increase in risk  totaling 5  million led to a post -model adjustment of 39  million as at June 30 2023,PROFIT
DZ Bank,Impact of macroeconomic conditions   The established models and processes for calculating expected losses on specific exposures or at portfolio level in  line with IFRS  9 have generally been retained,LOSS
DZ Bank,These effects are factored into the calculation of specific  loan loss allowances and in a more nuanced manner in the credit assessment and in decisions concerning  inclusion in watchlists for the early identif ication of risk,LOSS
DZ Bank,At portfolio level the forecast macroeconomic  conditions are taken into account by adjusting the model -driven default probability profiles used in economic  and regulatory risk management on the basis of shift factors,REGULATORY
DZ Bank,The macroeconomic sc enarios specifically look at future trends in the labor market interest rates in the money  market changes in gross domestic product inflation real estate prices and energy prices and are primarily  based on economic forecasts provided by the Economic R oundtable which is made up of representatives from  the entities in the DZ  BANK Group,INTEREST
DZ Bank,The risk parameters adjusted on the basis of the macroeconomic scenarios are then factored into the calculation  of loss allowances,LOSS
DZ Bank,This  ensures tha t the shift factors used are in line both with experts expectations and with the forecast changes in  macroeconomic factors for the calculation of expected losses,LOSS
DZ Bank,This aspect includes all  identifiable material increases in risk resulting from current developments and factors influencing the economy  that have yet to be included in the credit rating,CREDIT
DZ Bank,These factors specifically i nclude the war in Ukraine commodity  shortages supply chain difficulties high inflation coupled with soaring energy prices the problems resulting  from higher interest rates and the consideration of climate -related and environmental risks,INTEREST
DZ Bank,Overall additional loss allowances of 197  million were recognized as at June 30 2023 due to the expert -led  override of the shift factors determined using statistical methods  December 31 2022 188  million,LOSS
DZ Bank,This decision  reflected macr oeconomic developments in 2022 such as supply chain disruptions high inflation unavailability of  materials the shortage of skilled workers the rise in interest rates the gloomy economic outlook persistently  high energy prices a changed competitor s tructure and uncertainty about the spread of COVID -19 particularly  during the winter months,INTEREST
DZ Bank,The climate and environmental parameters currently have an only  immaterial impact on loss allowances,LOSS
DZ Bank,The effects on loss allowances will be examined more closely in the  context of planned sustainability initiatives,LOSS
DZ Bank,Loss allowances and gross carrying amounts   In the DZ  BANK Group loss allowances are recognized for the classes financial assets measured at fair value   financial assets measured at amortized cost finance leases and financial guarantee contracts and loan  commitments in the amount of the expected credit losses,LOSS
DZ Bank,The transactions  presented under financial liabilities held for trading are carried out using bonds issued including share  certificates index -linked certificates  and other debt certificates,BONDS
DZ Bank,The transactions under subordinated capital  are mainly carried out using subordinated bearer bonds,BONDS
DZ Bank,This is in line with the classification of investments held by insurance companies in  accordance with IFRS 9 which are predominantly assigned to the category financial asset s measured at fair  value through other comprehensive income,INVESTMENT
DZ Bank,With gains and  losses on investments held by insurance companies amounting to a net gain of  2302  million first half of 2022 net loss of 3628  million the amount reclassified in accordance with  IFRS 17,LOSS
DZ Bank,Exercising the option of recognition in the  reserve from other comprehensive income reduces the impact of the measurement -related volatilities of equity  and liabilities on the i ncome statement,EQUITY
DZ Bank,The effects recognized in profit or loss include firstly the effect of the time value of money resulting from  discounting with the locked -in yield curve for insurance contracts without direct participation features and  secondly the eff ect of changes in the time value of money resulting from insurance contracts with direct  participation features whose underlying items are assigned to the category financial assets measured at fair  value through profit or loss,PROFIT
DZ Bank,Insurance finance income o r expenses also include the difference between the  expected future payments covered by the liability for remaining coverage and the payments made in the  financial year from business involving contracts with direct participation features,LIABILITY
DZ Bank,Investment income recognized in other comprehensive income in connection with  insurance contracts measured under the modified retrospective approach or the fair  value approach   The reserve from other comprehensive income changed as a result of investment income in connection  with  insurance contracts measured under the modified retrospective approach or the fair value approach as  follows            million   2023   2022   Balance as at Jan,INVESTMENT
DZ Bank,An exact  assignment of the investments to the insura nce contract liabilities for the total portfolio or individual  subportfolios is neither possible nor envisaged in the German insurance market with the exception of unit - linked insurance contracts,INVESTMENT
DZ Bank,the fulfillment cash flows less the risk  adjustment and the present value of the companies future share of gross profit plus costs that cannot be  attributed directly,PROFIT
DZ Bank,In he alth insurance equity calculated in accordance with commercial law is also taken into  account owing to the rules on policyholder participation,EQUITY
DZ Bank,The Other column s hows investments for which there are no underlying contracts with direct participation  features,INVESTMENT
DZ Bank,For 10 -year government bonds of the Federal Republic of Germany an interest rate of 3,INTEREST
DZ Bank,Based on the  analyses and findings of the Economic Roundtable sensitivity analyses with a shift in interest rates of plus or  minus 50  basis points are calculated,INTEREST
DZ Bank,The following table shows the sensitivity of profit or loss before taxes and equity before taxes to a change in  the underlying parameters,PROFIT
