Bank Name,Financial Text,Financial Term
UmweltBank AG,Approximately6 billion 1000332  Letter from the Management Board Germanys greenest bank About UmweltBank Investing and providing for retirement sustainablyFinancing for environmental projectsSustainable investmentsGermanys green bank shareResponsible corporate governanceDialogue with stakeholdersAnalysis of the main sustainability aspects1222253740445658 Contribution  to the environment Environmental management systemEnvironmental performanceSustainability targetsReport of the Environmental Advisory BoardContact the Sustainability ManagementValidation of the environmental statement6468889196966 1 2 People at UmweltBank Member of the Management BoardSupervisory BoardEnvironmental Advisory BoardSustainable personnel policy100 103 109114 About this reportGRI content indexPublishing details and contactAnnual  Report Report of the Supervisory BoardManagement reportBalance sheetIncome statementNotes to the financial statementsIndependent auditors report126134 174 176 1782033 4 211212217 5 4 2022 to enable greater transformation,INVESTMENT
UmweltBank AG,However there are signs that a new  era is dawning in Germany  especially in security and energy policy,SECURITY
UmweltBank AG,In July the European Central Bank raised  interest rates for the first time in around ten years,INTEREST
UmweltBank AG,Within less than 12 months the key interest rate  rose from 0,INTEREST
UmweltBank AG,Savers but also banks have been waiting a long time for the low-interest  phase to end,INTEREST
UmweltBank AG,The speed and level of the interest rate hikes are posing challenges in the short term  however,INTEREST
UmweltBank AG,Our savings deposits on the other hand are mostly in accounts with short maturities and  currently rising interest rates,INTEREST
UmweltBank AG,Although the Bank can grant new loans and extensions at significantly  higher interest rates than a year ago the interest margin will only benefit from this in the medium  to long term,INTEREST
UmweltBank AG,Overall the Bank recorded a significantly increased interest financial  and valuation result in 2022 as well as a commission and trading result at the previous-year level,INTEREST
UmweltBank AG,Overall UmweltBank  ended the 25th year of its existence with a pre-tax profit of 39,PROFIT
UmweltBank AG,In addition the Bank is suc - cessively expanding two high-growth business areas investments in the equity of sustainable real  estate and renewable energy projects via the subsidiary UmweltProjekt GmbH on the one hand and  the green funds of the UmweltSpektrum brand on the other,INVESTMENT
UmweltBank AG,We now offer three in-house funds  under the UmweltSpektrum brand,FUNDS
UmweltBank AG,The wholly owned subsidiary Umwelt - Projekt GmbH bundles these investments with a current volume of around 750 million,INVESTMENT
UmweltBank AG,The investments are extensive but they are necessary and  will pay off    for customers for our employees and in the medium to long term for you as well  dear shareholders,INVESTMENT
UmweltBank AG,Your UmweltBank Management Board Goran Baic Member of the Management Board Areas of responsibilityJrgen Koppmann Spokesperson of the  Management Board  Areas of responsibilityHeike Schmitz Member of the  Management Board Areas of responsibility Financing Energy and Infrastructure  Projects Financing Real Estate ProjectsFinancing Private CustomersInvestmentsPersonnelTreasury  SustainabilityAccounting  Taxes  Operations Reporting Risk   Analytics Back Offi   ce CreditLegal  ComplianceOrganisational ManagementInternal AuditCustomer Care   Account Management Securities  PensionsInformation Technology   Project Management Customer Care  ServiceMarketing  PR years of UmweltBank Learn more about the exciting development of UmweltBank in its multimedia company history,INVESTMENT
UmweltBank AG,The  Bank does not engage in speculative transactions lending is not focused on profit  maximisation but on a positive ecological and social impact,PROFIT
UmweltBank AG,We combine economy and ecology by off  ering our customers at- tractive investments and financingsustainable projects exclusively,INVESTMENT
UmweltBank AG,Company UmweltBank Legal form Stock corporation Aktiengesellschaft Headquarters Nuremberg Germany Foundation 1997 Owners Approx,STOCK
UmweltBank AG,APRIL   Expansion of the fund range Two new funds under the UmweltS-pektrum brand enable investors to invest specifically in the topics of nature and people,FUNDS
UmweltBank AG,UmweltTreuhand GmbHOn its first birthday UmweltBank celebrates black figures with green money  Photovoltaic project financing UmweltBank off  ers building loans and mortgages for joint building venturesFlotation on the Regulated Unoffi   cial Market at the Frankfurt Stock Exchange  Founding of the subsidiaryUmweltProjekt GmbHUmweltBank aligns for the future with new brand profile UmweltBank is granted a  full banking licence Green savings products  Wind farm project financing Sustainable building loans and mortgages UmweltBank enables simple photovoltaic financing for  private customers with online toolPassing of the torchon the Management Board Stefan Weber and Goran Bai are new duo at the top First own fund  UmweltSpektrum Mix comes onto the market The new home of green money  UmweltHaus and UmweltQuartier in Nuremberg End of the KfWs 100000 Roofs pro-gramme UmweltBank launches its own subsidy programme Solar power for every roofUmweltBank 20031998 2007 2016 20182001 2010 2020 FUTURE1994 199725 years201415 The year 2022 marks an important milestone for UmweltBank,STOCK
UmweltBank AG,de25jahre 17 16 Sustainable products Building and residential  Residential properties  Joint building ventures  Residential projects  Social building   Investor projects  Commercial real estate UmweltWunschkredit  Ecological building measures  Photovoltaic systems  Tiny houses  e-mobilityRenewable energy sources   Wind power  Heating concepts  PhotovoltaicsSavings accounts   UmweltFlexkonto  UmweltFestzins  UmweltWachstumszins Securities   UmweltBank share  Green bonds  Eco funds Insurance   Base pension Rrup pension  Company pension plan  Private pension  UmweltVorsorge juniorInvestments and pensions Financing UmweltProjekt GmbH is a wholly owned subsidiary of UmweltBank that pools and grows  the Banks investment business,INVESTMENT
UmweltBank AG,Investments in sustainable projectsUmweltGarantie environmental guarantee Every euro that customers invest with UmweltBank is used in accordance with the  SDG  the United Nations Sustainable Development Goals,INVESTMENT
UmweltBank AG,Customers can be confident that the savings deposits and equity  are used exclusively for loans in support of environmental projects,DEPOSIT
UmweltBank AG,To check compliance with the UmweltGarantie the Bank computes the ratio of volume  of utilised environmental loans note loans for a specific purpose participating interests  green and social bonds plus its own investments with a positive SDG contribution to  the deposit volume of customers third-party loans from development banks and the  original equity brought into UmweltBank from the investors,INVESTMENT
UmweltBank AG,In the interest of the customers and employ- ees alike the Bank consciously eschews from any kind of sales quotas and individual  commission payments,INTEREST
UmweltBank AG,It is the only bank  in Germany to give the UmweltGarantie for savings investments,INVESTMENT
UmweltBank AG,All these offers are subject to  German statutory deposit protection,DEPOSIT
UmweltBank AG,The  funds investment philosophy is based on UmweltBanks  strict sustainability approach,INVESTMENT
UmweltBank AG,Therefore investments  are made in hand-picked companies that stand out  due to a particularly sustainable core business and act out of conviction,INVESTMENT
UmweltBank AG,UmweltSpektrum     The sustainable fund family for a future worth living in The UmweltSpektrum fund family UmweltSpektrum Natur UmweltSpektrum Mensch UmweltSpektrum Mix The shape-the-future fund The strengthen-the-  community fundThe protect-the-  environment fund  Affordable and clean energy  Climate protectionmeasures  Clean water and anitation facilities  Health well-being and no  poverty  Quality education  Peace justice and strong institutions Sustainable cities and commu-nities  Responsible consumption  Focus on smaller and medi-um-sized enterprises A global equity fund with an  emphasis on environmental  sustainability goals,EQUITY
UmweltBank AG,Interested investors can find current information on the UmweltSpektrum brand funds at www,INTEREST
UmweltBank AG,deA global equity fund with an  emphasis on social coexistence,EQUITY
UmweltBank AG,The UmweltBank experts take the final decision for inclusion in the UmweltSpektrum funds after again  checking the issuers ecological and social creditworthiness,FUNDS
UmweltBank AG,In the event of  controversy issuers are removed and investments sold if necessary,INVESTMENT
UmweltBank AG,Fund management may invest freely  within the certified investment universe,INVESTMENT
UmweltBank AG,It does this by evaluating the  investments according to economic criteria,INVESTMENT
UmweltBank AG,Its aim is to support environ- mental projects with know-how and low-interest loans,INTEREST
UmweltBank AG,Important criteria for the lending decision are the personal impression of the lending  partner the investment motive and of course economic creditworthiness,INVESTMENT
UmweltBank AG,UmweltBanks financing activities are geared towards long-term investments,INVESTMENT
UmweltBank AG,According to the EU Disclosure Regulation SFDR they qualify as so-called dark green funds Article 9 funds,FUNDS
UmweltBank AG,Economic rating The economic creditworthiness is assessed by UmweltBank with the help of an eco- nomic rating based on a grading system with grades 1 to 6 best to worst,CREDIT
UmweltBank AG,A project rated as economically very good as well as ecologically very beneficial thus  receives a credit code of 11 a project rated economically good as well as ecologically very  beneficial receives a credit code of 21 and so on,CREDIT
UmweltBank AG,Additional  revenue can be generated through direct marketing on the electricity exchange,REVENUE
UmweltBank AG,UmweltBank applies  the principle of The more ecological a building is to be the more favourable the interest  rate will be,INTEREST
UmweltBank AG,One of UmweltBanks specialist areas is providing finance  for not-for-profit residential projects,PROFIT
UmweltBank AG,Various forms of participation are possible  Investments in existing projects  Project purchase  Joint project development with partner companies UmweltBank holds various sustainable participating interests and if required also as - sumes commercial management via subsidiaries,INVESTMENT
UmweltBank AG,It also  currently has participating interests in over 950 flats and roughly 75 commercial premises  in the letting or construction phase,INTEREST
UmweltBank AG,For the near future the company plans to further  expand its investments in solar and wind farms as well as construction projects through  UmweltProjekt GmbH,INVESTMENT
UmweltBank AG,In addition the Bank actively contributes to the energy transition with its investments  in renewable energy projects,INVESTMENT
UmweltBank AG,Due to the strategic focus on renewable energy sources and ecological  housing an investment in the green bank is also an investment in future trends,INVESTMENT
UmweltBank AG,With a  market capitalisation of approximately 480 million December 2022 UmweltBank is  one of the largest companies listed in the Munich Stock Exchange maccess segment  for medium-sized enterprises,STOCK
UmweltBank AG,Around 85 of the shares are in free float and can be  traded on XETRA Tradegate and other stock exchanges,STOCK
UmweltBank AG,In June 2001 the UmweltBank share  celebrated its dbut on the Regulated Unoffi   cial Market of the Frankfurt Stock Exchange,STOCK
UmweltBank AG,Since 1 September 2016 the green security has been listed in the maccess segment of  the Munich Stock Exchange,STOCK
UmweltBank AG,GLS Gemeinschafts- bank eG 15 Free float 85 Excellent sustainable investment  UmweltBank has had the Prime rating in the ISS-ESG sustainability  rating for many years,INVESTMENT
UmweltBank AG,deanalysten Continuous strengthening of equity At the end of 2022 UmweltBanks regulatory equity amounted to approximately 529  million excluding the planned accumulation of profits for the 2022 financial year  compared to 427 million in the previous year,PROFIT
UmweltBank AG,In addition equity was strengthened by the accumulation of profits and the  high acceptance rate of the stock dividend,PROFIT
UmweltBank AG,In addition  to share capital and reserves profit participation rights also count as regulatory equity,PROFIT
UmweltBank AG,This was followed in 2018 2019 and  2020 by the issue of the Green Bond junior a fixed-interest bond with subordination  rights,INTEREST
UmweltBank AG,UmweltBank invests its equity and deposits exclusively in sustainable i,DEPOSIT
UmweltBank AG,The  Management Board and the Environmental Advisory Board have established investment  and financial principles for assessing which projects the Bank supports,INVESTMENT
UmweltBank AG,The Compliance function includes in particular the prevention and detection of money  laundering and other criminal offences as well as compliance with conduct and organisa - tion requirements under capital market law consumer protection information security  and data protection,SECURITY
UmweltBank AG,UmweltBank has established a central complaint management system to which cus - tomers and interested parties can turn,INTEREST
UmweltBank AG,The purpose of central complaint  management is to ensure that information is reviewed and assessed objectively and  in the interest of the customer,INTEREST
UmweltBank AG,A total of 31 security breaches were registered including one case  of illicitly obtaining access data for online banking,SECURITY
UmweltBank AG,In the case of the Banks own investments com - pliance with the positive and exclusion criteria is continuously monitored,INVESTMENT
UmweltBank AG,Thus three remarkable initiatives were the  happy recipients of a donation from the campaign the Nuremberg non-profit organi- sation Wolfsherz Stiftung pro Artenvielfalt and the Jane Goodall Institute,PROFIT
UmweltBank AG,From  collecting deposit cups at concerts to hitchhiking races across Europe to selling fair toilet  paper The association shows how easy it can be to donate and that every contribution  no matter how small counts,DEPOSIT
UmweltBank AG,New customer promotion   Membership in associations and initiatives Through its numerous memberships UmweltBank supports in particular those interest  groups and associations that advocate for preserving the environment and an ecological  way of life,INTEREST
UmweltBank AG,Do good and talk about it  UmweltBank seeks open dialogue with the interest  groups that are directly or indirectly aff  ected by its activities the stakeholders,INTEREST
UmweltBank AG,Annual general meeting  Sustainability and  Annual Report  Press releases  Participation in ratings  Attendance at capital marketconferences  Road shows  Investor Relations NewsletterCapital market  Works Council  Internal communication  Eventsincluding festivals and training trips  Feedback talks  Board breakfast  Bank plenumEmployees Customersinterested parties Telephone support  Site visits  Presence at trade fairs  Magazine and blog Bank  Umwelt  Newsletter  Social media  Satisfaction surveysSupervisory BoardEnvironmental  Advisory Board Management meetings  Workshops SocietyPressProfession-al Public  Science Dialogue with the press  Lectures  Expert interviews  Participation in competi- tionsPoliticsFinancial Supervisory  AuthorityNetworksCompetitors Reporting  Exchange of information  Memberships  SponsoringdonationsDialogue with stakeholdersUmweltBank interacts with a wide range of stakeholders,INTEREST
UmweltBank AG,Indirectly however  UmweltBank has a considerable influence on the environment when defining lending  criteria and in its own financial investments,INVESTMENT
UmweltBank AG,This is attributable to the easing of  restrictions due to the coronavirus pandemic,RESTRICTIONS
UmweltBank AG,It is  precisely the definition of the criteria for granting loans and the selection of the Banks  own financial and capital investments that have a significant influence on the environ - ment,INVESTMENT
UmweltBank AG,For every kilometre cycled the Bank donates one euro to ecological and The Banks own investments  liquidity reserve and investment portfolio  Legal requirements and commercial prudence require that banks must hold a liquidity  reserve,INVESTMENT
UmweltBank AG,This reserve ensures that customer deposits can be repaid at any time and  open loan commitments can be paid out,DEPOSIT
UmweltBank AG,In addition banks invest their own funds and  surplus liquidity in securities for the longer term investment portfolio,INVESTMENT
UmweltBank AG,Common forms  of investment are for example credit balances at the German Bundesbank as well as  covered and uncovered bonds issued by European countries,INVESTMENT
UmweltBank AG,Suitable investments are selected on the basis of the proprietary UmweltRating which  checks each investment against strict positive and exclusion criteria,INVESTMENT
UmweltBank AG,If these are not fulfilled the investment is excluded,INVESTMENT
UmweltBank AG,If an issuer does not meet the requirements of the UmweltRating no new  investments are made and any existing holdings are sold in a timely manner taking  economic arguments into account,INVESTMENT
UmweltBank AG,It receives a quarterly report  on the performance and conducts an annual audit of all own investments,INVESTMENT
UmweltBank AG,Lending Lending enables banks to exert great influence on their customers investments,INVESTMENT
UmweltBank AG,In the interest of  better readability these CO2  equivalents are expressed as CO2  in the main text whereas the notation CO2e is used in the tables,INTEREST
UmweltBank AG,Here  UmweltBanks own investments participating interests in operating companies are  considered as well as the projects financed,INVESTMENT
UmweltBank AG,The emissions of financed real estate and  participating interests in real estate are also included here,INTEREST
UmweltBank AG,Participating financial institutions have committed to disclose  the greenhouse gas emissions of their loans and investments www,INVESTMENT
UmweltBank AG,Calculation of emissions project financing With its financing activities UmweltBank contributes to reducing CO2  emissions through  direct investments in projects and through lending for ecological projects,INVESTMENT
UmweltBank AG,In cases where there was no investment volume it  was also assumed that the loan volume was equal to 70 of the investment volume,INVESTMENT
UmweltBank AG,The equity share approach is used in all calculations this means that both avoided emis - sions and emissions are considered in relation to UmweltBanks participating interest or  financing as part of the total volume of the investment,INVESTMENT
UmweltBank AG,Example with a total investment  of 10 million and an UmweltBank loan of 8 million only 80 of the avoided emissions  and emissions are applied,INVESTMENT
UmweltBank AG,Calculation of emissions Portfolio A own investments of the Bank Data from an external data provider is used to calculate the emissions of Portfolio A,INVESTMENT
UmweltBank AG,The aim is to align the  credit and investment portfolios in line with the goals of the Paris Climate Agreement,INVESTMENT
UmweltBank AG,Loan financing and participating interests CO2 impact of real estate financing and participating interests in real estate projects  Unit     2021Emissions     2022Change in  Real estate financing tCOe 13811,INTEREST
UmweltBank AG,The cal- culation of real estate financing and participating interests is currently based on many  conservative assumptions,INTEREST
UmweltBank AG,In contrast to the calculation of the CO2 balance of the lending business yield reports are not used for participating interests as here the actual emis - sions avoided and emissions are available,INTEREST
UmweltBank AG,CO2 impact of participating interests in operating companies for wind and photovoltaic  projects          Emissions Unit 2022  CO 2 impact of investments in Portfolio A tCOe 121633,INVESTMENT
UmweltBank AG,The  comparison of the achieved avoidance of CO2 through financing and its own partici-pating interests in renewable energy sources and total assets serves to illustrate Um-weltBanks environmental performance,INTEREST
UmweltBank AG,Scope 1 0 Participating interests 76000 Financing 1302000Scope 20Scope 3 215000 Emissions Achieved avoidance  of over 1160000 t CO2eAvoided emissionstonnes of CO2,INTEREST
UmweltBank AG,Coverage and data quality Asset class coverage Financing and participating interests in the field of renewable energies are attributable  to the asset class project finance according to the PCAF standard,INTEREST
UmweltBank AG,Reporting will be expanded step by step with the aim of reporting 100 of the emissions arising from financing and participating interests,INTEREST
UmweltBank AG,In the asset class commercial real estate and participating interests assumptions are made about the emissions of the financed properties and the attribution share of Umwelt-Bank is also calculated using verified assumptions,INTEREST
UmweltBank AG,She founded the  Female Finance Forum in 2017 with the aim of awakening womens interest in money and  sustainable financial products as well as providing them with the necessary knowledge  to take finances into their own hands,INTEREST
UmweltBank AG,One of the regular tasks of the Environmental Advisory Board is to review UmweltBanks  own investments and treasury transactions with regard to compliance with sustain - ability criteria,INVESTMENT
UmweltBank AG,These management rules ensure that  UmweltBanks own investments are always in compliance with the requirements of  its articles of association,INVESTMENT
UmweltBank AG,The review of the lending business and thus the use of funds from customer deposits  according to the same criteria are also among the key tasks of the Environmental Ad - visory Board,DEPOSIT
UmweltBank AG,UmweltGarantie The Environmental Advisory Council confirms that the use of funds by UmweltBank  in the 2022 financial year was in accordance with the articles of incorporation and de- termines compliance with the UmweltGarantie,FUNDS
UmweltBank AG,In accordance with the articles of association  the Bank has exclusively financed or promoted environmentally friendly and sustainable  projects with the funds of its customers,FUNDS
UmweltBank AG,The declaration of the environmental auditor  confirms the reliability of the data and information in the sustainability report as well as  compliance with the requirements of the EMAS Regulation,LIABILITY
UmweltBank AG,de I Tel 49 0 9405 9 49850 I Fax 49 0 9405 955 82 29 I Geschftsfhrer Thorsten Grantner ENVIRONMENTAL VERIFIERS DECLARATION ON VERIFICATION AND VALIDATION ACTIVITIES  The EMAS environmental verifier signing for OmniCert Umweltgutachter GmbH with  registration number DE-V-0360 Thorsten Grantner verifier registration number DE-V-0284 accredited or licensed for the  scopes       64,CREDIT
UmweltBank AG,At Fleming Funds Management now JP  Morgan Asset Management she was responsible for sales and marketing in Europe,FUNDS
UmweltBank AG,After that she was managing director of Schroder Investment Management where  she was responsible for Germany and Austria,INVESTMENT
UmweltBank AG,Frankfurt  Managing Director of   Invest in Visions GmbHEdda Schrder Since completing his doctorate on brand management at credit institutions Dr  Michael  Maier has held various management positions in the banking industry,CREDIT
UmweltBank AG,The Wrzburg-based business  ethicist scrutinises areas of questionable regulatory policy that pose a threat to viable  global sustainable development and free societies,REGULATORY
UmweltBank AG,At imug Beratungsgesellschaft fr sozial-kologische Innovationen she established the  Sustainable Investment department and was responsible for the evaluation of companies  under sustainability criteria,INVESTMENT
UmweltBank AG,Her goal is to awaken the  interest of women in money and financial products and to provide them with the  knowledge necessary to take their finances into their own hands,INTEREST
UmweltBank AG,She is an economist  BSc in International Economic Studies Master in Public Policy and worked in the area  of sustainable investment at the Deutsche Bundesbank,INVESTMENT
UmweltBank AG,There are no individual  targets for achieving specific revenue or sales figures,REVENUE
UmweltBank AG,This ensures fair treatment of  customers and motivates employees to make decisions based on values rather than profit,PROFIT
UmweltBank AG,As dedicated specialists in the field of ecological investment and professional financing  of environmental projects the employees are UmweltBanks most important asset,INVESTMENT
UmweltBank AG,All permanent employees with an open-ended  employment contract can take advantage of an interest-free loan of up to 30000 for  the purchase or renovation of an owner-occupied property,INTEREST
UmweltBank AG,In  particular the central banks rapid shift away from their long-standing low interest rate  policy due to the massive leap in inflation associated with the war made itself noticed  in business,INTEREST
UmweltBank AG,The increased risks also led to further intensification of regulatory authority  requirements,REGULATORY
UmweltBank AG,No conflicts of interest on the part of Supervisory Board  members arose in the financial year,INTEREST
