Bank Name,Financial Text,Financial Term
UmweltBank AG,There was an audit committee of the Supervisory Board in place over the entire financial year a credit committee was formed in October 2022,CREDIT
UmweltBank AG,The credit committee is tasked with preparing Supervisory Board resolutions on loans  to governing bodies in accordance with Section 15 of the German Banking Act Kredit- wesengesetz  KWG,CREDIT
UmweltBank AG,From its creation the credit committee was chaired by Heinrich Klotz Susanne Horn  was elected as his deputy,CREDIT
UmweltBank AG,The Management Board reported  to the Supervisory Board in depth about the intended operating policy and the financial  investment capital and HR planning the profitability of the company and the equity on a  regular basis on the course of business including but not limited to current income costs  and the expenses for risk provisions and the companys position and in a timely manner  about transactions that are potentially of considerable importance for the companys  profitability or liquidity,PROFIT
UmweltBank AG,The Supervisory Board and the audit committee entered into intense discussions with the  Management Board on the loss incidents impacting the result for the year and examined  on an ongoing basis the compliance of the Management Boards actions with its duties,LOSS
UmweltBank AG,Furthermore the Federal Financial  Supervisory Authority BaFin being the regulatory authority responsible exercised its  right under Section 44 4 Sentence 1 to send representatives to attend the meetings  held on 7 October and 2 December 2022,REGULATORY
UmweltBank AG,The audit committee held meetings on five occasions to fulfil the tasks entrusted to it  the credit committee that was created in October 2022 came together for one meeting,CREDIT
UmweltBank AG,The scheduled meetings of the Supervisory Board each included an in-depth report by  the Management Board on the economic and ecological development of the company  the risk control system and the banking business on the deposits side and on the lending  side,DEPOSIT
UmweltBank AG,Also reports by the Management Board on topics from the area of human resources  and marketing and questions and issues of IT security were discussed,SECURITY
UmweltBank AG,At the meeting on 24 June 2022 the CEO of the Serbian 3bank in which UmweltBank  AG holds a 30 participating interest was given the opportunity to introduce himself  in person and to explain 3banks business operations,INTEREST
UmweltBank AG,Furthermore the report by Um - weltBanks information security office was also heard and discussed,SECURITY
UmweltBank AG,One of the central items for discussion at the meeting on 7 October 2022 included  the decision on creating a credit committee for preparing approval resolutions of the  Supervisory Board on the granting of loans to a governing body as the Supervisory  Board anticipated an increase in the number of applications for the granting of such  loans to related parties whether companies or individuals due to the Banks extensive  business with participating interests,INTEREST
UmweltBank AG,The Management Board and the Supervisory Board  discussed in particular detail the position of the company under the impression of the  challenging general economic and interest situation and the company-specific chal - lenges on account of the migration of the core banking system and existing deficiencies  with regard to the regulatory requirements for banks,INTEREST
UmweltBank AG,In addition  Dr Meike Gebhard as managing director of Utopia GmbH in which UmweltBank holds a  participating interest of just over one-quarter of its capital was given the opportunity  to introduce herself and the company she manages to the Supervisory Board in more  detail and in person the Supervisory Boards schedule for the following year was also  coordinated,INTEREST
UmweltBank AG,Furthermore discussions  also covered training measures for the Supervisory Board the findings of a survey on  employee satisfaction a first draft of the budget figures for the following financial year  and the reporting on recent contacts to the regulatory authority in particular with regard  to the deficiencies identified in the regulatory requirements for banks in general and the  recent special audit by Deutsche Bundesbank in particular,REGULATORY
UmweltBank AG,Approval and adoption of the annual financial statements proposal for the appro- priation of profit Baker Tilly GmbH  Co,PROFIT
UmweltBank AG,The Supervisory Board also reviewed the Management Boards proposal for the appro- priation of profit it concurs with this proposal in line with the recommendation of the audit committee,PROFIT
UmweltBank AG,The Management Boards proposal appropriately takes account of  both the shareholders dividend interest and in the necessary creation of further capital  for the companys further growth and to ensure sound capitalisation,INTEREST
UmweltBank AG,Over and above this the Bank also invests equity directly or indirectly through its wholly owned subsidiary UmweltProjekt GmbH in real-estate and energy projects and in individual cases in selected companies in the sustainability sector,EQUITY
UmweltBank AG,It guarantees  that savings deposits of its customers and the capital of its shareholders are used ex - clusively for loans to promote environmental projects,DEPOSIT
UmweltBank AG,Alongside short- to long-term savings accounts the Banks range of products also includes sustainable securities its own share own bonds project and corporate bonds of other issuers and sustainable investment funds,INVESTMENT
UmweltBank AG,Under the UmweltSpektrum brand UmweltBank offers three in-Management report of UmweltBank AG Nuremberg 2022 financial yearhouse sustainability funds,FUNDS
UmweltBank AG,Furthermore there are no set targets for the achievement of specific revenue or sales figures  and therefore no false incentives with regard to customer care,REVENUE
UmweltBank AG,These put extensive  restrictions on trade and capital flows between the EU and Russia but also targeted  individuals and organisations,RESTRICTIONS
UmweltBank AG,In the past year the European Central Bank ECB ended its expansive monetary  policy and started to raise interest rates again for the first time after around ten years,INTEREST
UmweltBank AG,In four steps the interest rate for main refinancing operations  rose from 0,INTEREST
UmweltBank AG,Alongside this the ECB discontinued the net purchases under the Pandemic Emergency Purchase Programme PEPP for the bonds of public  and private debtors mid-year as planned,BONDS
UmweltBank AG,Within the context of the coronavirus pandemic the ECB held TLTRO  funds in readiness in order to provide stronger incentives for banks not to reduce their volume of lending during the crisis,FUNDS
UmweltBank AG,The situation is being exacerbated by the large number of refugees from Ukraine and  the rise in costs and interest rates leading to falling investment in housing construc - tion,INVESTMENT
UmweltBank AG,According to the Federal Network  Agencys core energy market data register the addition to the stock of photovoltaic  systems increased to around 7,STOCK
UmweltBank AG,With the UmweltSpektrum Mensch and the UmweltSpektrum Natur UmweltBank  launched two further in-house funds on the market in 2022,FUNDS
UmweltBank AG,With the UmweltSpektrum  brand UmweltBank is positioning itself on the growing market for sustainable funds,FUNDS
UmweltBank AG,As  at 31 December 2022 the three own funds recorded a volume of around 131 million  i,FUNDS
UmweltBank AG,Since the outbreak of  the Ukraine war investors have been cautious with investments,INVESTMENT
UmweltBank AG,UmweltBank sold a participating interest in a wind farm at the end of 2022 in a market  favourable to renewable energy sources,INTEREST
UmweltBank AG,total assets plus contingent liabilities and other ob - ligations irrevocable credit commitments for example came to 6602,CREDIT
UmweltBank AG,The  total volume of customer credit including open commitments of 535,CREDIT
UmweltBank AG,Over the course of the year  interest for ten-year real estate loans more than quadrupled to around 4,INTEREST
UmweltBank AG,This explains the significant  uncertainty and caution among consumers and persons interested in buying real estate,INTEREST
UmweltBank AG,It was not  possible to match the previous-year figure of 421 million as projects with a volume of credit of more than 170 million had been postponed into 2023,CREDIT
UmweltBank AG,In the area of wind turbines a plant output of around 58 MW was financed in 2022  with a volume of new credit of 94 million,CREDIT
UmweltBank AG,The Bank checks compliance  with the UmweltGarantie by comparing the ratio of volume of utilised environmental  loans note loans for a specific purpose participating interests green and social bonds  plus its own investments with a positive SDG contribution to the deposit volume of  customers third-party loans from development banks and the original equity brought  into UmweltBank from the investors,INVESTMENT
UmweltBank AG,After adoption  of the annual financial statements the total regulatory capital ratio came to 16,REGULATORY
UmweltBank AG,Despite the repayment of TLTRO funds totalling 300 million  total assets increased slightly,FUNDS
UmweltBank AG,Refinancing expenses increased more sharply than interest income,INTEREST
UmweltBank AG,This devel - opment led to the average interest margin to decrease from 1,INTEREST
UmweltBank AG,The financial result includes the current income from equities and other non-fixed-in - terest securities participating interests and affiliated companies and the balance of  write-ups and write-downs on participating interests shares in affiliated companies and  securities treated as non-current assets,INTEREST
UmweltBank AG,The increase from 2965 thousand in 2021 to  24829 thousand in the reporting year primarily results from the sale of a participating  interest in a wind farm as well as a higher current income from participating interests  shares in affiliated companies and securities treated as non-current assets,INTEREST
UmweltBank AG,This figure includes direct write-downs of receivables of 10 thousand previous year  26 thousand write-downs on receivables and securities of the liquidity reserve of  238 thousand previous year 51 thousand and profits and losses from the disposal of  securities of the liquidity reserve netted in a loss amounting to 37 thousand previous  year profit of 20 thousand,PROFIT
UmweltBank AG,The commissions and net trading income contains commission income and expenses  from the credit securities and insurance business as well as profits and losses from  trading with equity and bond funds and bonds,PROFIT
UmweltBank AG,The decrease from 9421 thousand to 9345 thousand was due to a slight decrease in price gains from trading in bonds and  investment funds,INVESTMENT
UmweltBank AG,The revenue in the securities and intermediation business came to  around 104,REVENUE
UmweltBank AG,This change is primarily due  to expenditure in connection with operating loss incidents,LOSS
UmweltBank AG,This decline is due among other things to purchases of bonds  issued by public bodies or banks and the repayment of Bundesbank TLTRO funds,BONDS
UmweltBank AG,The volume of bonds and other fixed-interest securities was 2365307 thousand as  at 31 December 2022 23,INTEREST
UmweltBank AG,The decrease in the portfolio of participating interests and shares in affiliated com - panies of 38388 thousand to 35768 thousand is primarily attributable to the sale  of a participating interest in a wind farm,INTEREST
UmweltBank AG,This rise is  predominantly due to the purchase of shares in cooperatives as a strategic investment  and rights to tax refunds,INVESTMENT
UmweltBank AG,Alongside equity and longer-term deposits public subsidies for environmental projects  serve as a source of long-term funding,DEPOSIT
UmweltBank AG,Liabilities to banks also  includes funds in connection with the Bundesbanks targeted longer-term refinancing  operations of 770000 thousand previous year 1070000 thousand,FUNDS
UmweltBank AG,All overnight deposits come to 2172885 thousand and make up 68,DEPOSIT
UmweltBank AG,This is followed in second place by savings  deposits of 809933 thousand or a share of 25,DEPOSIT
UmweltBank AG,The decrease in deferred income from 771 thousand to 507 thousand results from  one-off payments received on receivables from customers that are recorded as income  distributed over the period of fixed interest of the loans,INTEREST
UmweltBank AG,The item lower-ranking liabilities  includes the UmweltBank-CoCo-Bond 20162017  in the amount of 25954 thousand previous year 25954 thousand the Umwelt - Bank-Green-Bond-junior in the amount of 41951 thousand previous year 41951  thousand and registered bonds in the amount of 20000 thousand previous year  20000 thousand,BONDS
UmweltBank AG,The equity recognised on the balance sheet increased by 11381 thousand from 245119  thousand to 256500 thousand,EQUITY
UmweltBank AG,The irrevocable credit commitments increased to 535302 thousand previous year  463192 thousand,CREDIT
UmweltBank AG,After adoption of the 2021 annual financial statements the regulatory equity came to  426,EQUITY
UmweltBank AG,Upon adoption of the 2022 annual financial statements equity increased  to 529,EQUITY
UmweltBank AG,According to the provisions of the Capital Requirements Regulation  CRR valid as of the reporting date UmweltBank is subject to the following equity ratios  taking account of this surcharge as at 31 December 2022 The increase in the ratios is essentially attributable to the increase in own funds,FUNDS
UmweltBank AG,Over the financial year the key figures exceeded the minimum regulatory requirements  at all times,REGULATORY
UmweltBank AG,In this context the forecast was exceeded due to the following  material effects For instance customer deposits increased in 2022 more sharply than forecast,DEPOSIT
UmweltBank AG,Alongside this changed conditions meant that less TLTRO funds were repaid  than originally planned,FUNDS
UmweltBank AG,Net interest income was down on the previous years figure and was thus in line with the forecast,INTEREST
UmweltBank AG,Since then investors have been cautious  with investments,INVESTMENT
UmweltBank AG,The ratio of the volume of utilised environmental loans note loans for a specific pur - pose participating interests and greensocial bonds to the deposit volume provides a  coverage of 107,INTEREST
UmweltBank AG,For 2022 UmweltBank has refined its CO 2 accounting and for the first time included the  emissions from investments in Portfolio A,INVESTMENT
UmweltBank AG,In this respect UmweltBank differentiates between the  following material risk types  Credit risks  Market price risks  Liquidity risks  Operating risks  Sales risk In addition risk concentrations within a risk type intra  risk concentrations overarching risk types inter  sustainability risks as a cross-sectional category and  reputational risks as a cross-sectional category  are taken into consideration,CREDIT
UmweltBank AG,Within the scope of the concept of risk-bearing capacity UmweltBank sees contin - uation of its business operations taking account of the regulatory minimum capital  requirements for banks as its overarching goal,REGULATORY
UmweltBank AG,In this light  UmweltBank is using a going-concern approach with a profit and loss PL oriented  perspective as a leading control instrument for the last time as at 31 December 2022,PROFIT
UmweltBank AG,The capital requirements to cover the entire unexpected risk consisting of the total  of credit risk market price risk liquidity risk and operational risk is determined using  quantitative models,CREDIT
UmweltBank AG,In both cases continuation of business activities is possible without substantial  restrictions,RESTRICTIONS
UmweltBank AG,The credit risk is limited already by the fact that only those types of loans stated in the  credit risk strategy  are permitted and that in turn clear assessment criteria have been  defined for the same,CREDIT
UmweltBank AG,The economic rating system consists of six credit rating grades for credit exposures and  three further rating categories for mezzanine and equity capital and for participating  interests,INTEREST
UmweltBank AG,This overall economic assessment is based on customers personal credit rating  their income level and their financial circumstances each weighted as one-third,CREDIT
UmweltBank AG,In order to refine how the credit risk is measured differentiation of the rating  categories is being introduced among other developments and the previously separate  rating categories for mezzanine and equity capital or as the case may be participating  interests are implemented in the ratings for credit exposures,INTEREST
UmweltBank AG,As part of the Banks ongoing credit monitoring system the borrowers economic  circumstances and the recoverability of the collateral they provided are reviewed on a  regular basis,CREDIT
UmweltBank AG,At the beginning of 2022 this simulation  was still based on the Banks historical risk provision ratios which were determined  annually specifically for each credit rating and industry,CREDIT
UmweltBank AG,Alongside the recognition of specific allowances according to the regulatory  definition of default a default event also includes further events for example a credit  rating downgrade,CREDIT
UmweltBank AG,In addition the credit risk is also taken into consideration in investments and participating  interests,INVESTMENT
UmweltBank AG,Credit risk is subdivided into counterparty default risk and credit rating risk of  items with an additional external rating such as Pfandbriefs or term deposits at other  banks and into counterparty default risk of items without an external rating participat - ing interests for example,INTEREST
UmweltBank AG,For securities participating interests and shares in affiliated companies without an  external rating  UmweltBank also assumes a fictitious 50 default of the largest single  item for the last time as at 31 December 2022,INTEREST
UmweltBank AG,When selecting the largest single item the  Banks direct participating interests and the participating interests of the wholly-owned  155 154 2022 subsidiary UmweltProjekt GmbH are taken into consideration,INTEREST
UmweltBank AG,Guardrails have been put in place for the Banks liquidity reserves and investments in  securities with the aim of minimising risk,INVESTMENT
UmweltBank AG,Investments are made in central bank deposits  fixed and variable-interest securities Pfandbriefs public bonds or deposits at banks,INVESTMENT
UmweltBank AG,The credit risk report prepared on a regular basis presents UmweltBanks entire credit  portfolio broken down by customer groups rating categories industries and volume con - centrations,CREDIT
UmweltBank AG,In this context both the volume of credit and the number of exposures are  evaluated,CREDIT
UmweltBank AG,Notable exposures such as large loans participating interests loans requiring  management attention or partially impaired cases are presented and commented on,INTEREST
UmweltBank AG,A credit rating matrix maps the classification of the loans in the ecological and economic  risk classification system,CREDIT
UmweltBank AG,In addition investments in securities are presented separately,INVESTMENT
UmweltBank AG,Market price risks The market price risk is defined as the risk of a change in the market price or market  interest rates,INTEREST
UmweltBank AG,Credit spread risks are consequently allocated to the market price risk,CREDIT
UmweltBank AG,The market price risk and interest rate exposure strategy forms the basis for man - aging the market price risk,INTEREST
UmweltBank AG,Market price risks at UmweltBank take the form of interest  rate exposure in particular,INTEREST
UmweltBank AG,Interest rate exposure includes interest-rate-induced price  change risks,INTEREST
UmweltBank AG,With regard to investments in securities the Bank pursues a buy and hold strategy,INVESTMENT
UmweltBank AG,The daily overview of investments in securities based on the previous days closing rate  provides information on the current development and the resulting hidden reserves and  potential need for impairment,INVESTMENT
UmweltBank AG,The interest rate exposure  generally consists of impairment of securities and higher  interest expenses potentially arising from changing market interest rates that are not  counterbalanced by a corresponding rise in interest income since the interest rates for  assets can only be increased in some cases due to the application of fixed rates,INTEREST
UmweltBank AG,The  differences in the fixed interest rates arise primarily on account of differing customer  interests in the area of financial investment and in the area of borrowing,INVESTMENT
UmweltBank AG,The interest rate exposure applied for the last time as at 31 December 2022 in the peri - odic calculation of risk-bearing capacity is calculated on the basis of three interest-rate  scenarios A parallel shift in the yield curve by 204 basis points BPS,INTEREST
UmweltBank AG,A parallel shift in the yield curve by -168 BPS with interest rates for customer de - posits not being able to fall below 0,INTEREST
UmweltBank AG,An inversion of the yield curve with an increase of up to 185 BPS in the short-term  157 156 2022 Interest rate exposure in terms of present valueInterest rate shock  200 basis pointsInterest rate shock  -200 basis points Change in present value in  thousands -65286 69011 Change in present value in relation to equity in -12,INTEREST
UmweltBank AG,Net  interest income and the valuation result of the liquidity reserve in the respective scenario  is compared with the net interest income and the valuation result of the liquidity reserve  of the rolling plan,INTEREST
UmweltBank AG,In addition to interest rate exposure a figure based on the income statement that was  used for the last time as at 31 December 2022 UmweltBanks interest rate exposure  in terms of present value is also determined in the regular Risk Report as specified by  the regulatory authorities according to circular Circular 062019 BA  Interest rate  risk in the banking book,INTEREST
UmweltBank AG,The scenario with the highest risk value is  the interest rate shock 200 basis points,INTEREST
UmweltBank AG,As at the 31 December 2022 reporting date the risk-bearing capacity in terms of present  value provided with a set of scenarios specified by the regulatory authorities is as follows   In addition UmweltBank also measures credit spread risks,CREDIT
UmweltBank AG,These result from changes  to the capital markets assessment of the counterparty default risks of bonds and price  changes triggered by the same,BONDS
UmweltBank AG,Credit spread risks are calculated only for the securities of the liquidity reserve,CREDIT
UmweltBank AG,Equity risks were not disclosed as the items are included in non-current assets and  accounted for using the less strict lowest-value principle,EQUITY
UmweltBank AG,For liquidity management purposes UmweltBank held as at 31 December 2022 a credit  balance with Deutsche Bundesbank and especially liquid Pfandbriefs and bonds issued  by public bodies or banks,BONDS
UmweltBank AG,Significant sources of the Banks funding are the deposit-taking  business and refinancing through development banks specifically the KfW and Land - wirtschaftliche Rentenbank and the Bundesbanks targeted longer-term refinancing  operations TLTRO II and TLTRO III,DEPOSIT
UmweltBank AG,For these deposits by banks there were restrictions  on disposal with regard to bonds,DEPOSIT
UmweltBank AG,In addition the Planning scenario In  millions Especially liquid funds liquidity potential 1198 Cumulated liquidity exposure within 6 months -170 159 158 2022 method for determining the refinancing risk was converted to a widening of the spread,FUNDS
UmweltBank AG,Worst risk scenario In  millions Especially liquid funds liquidity potential 954 Cumulated liquidity exposure within 6 months -650   Operating risks UmweltBank defines operating risk as the risk of direct or indirect loss incurred as a  consequence of the inadequacy or failure of internal procedures people and systems  or as a result of external events,LOSS
UmweltBank AG,The strategic objective consists of limiting operating risks and the associated losses to  an acceptable residual risk provided that the measures necessary for this are economi - cally justified from a costbenefit perspective,LOSS
UmweltBank AG,UmweltBanks operating risks mainly arise  from information technology IT from political statutory or regulatory developments  in the banking sector from how structures and procedures are organised and from the  loss of employees with special expertise or experience,LOSS
UmweltBank AG,In the area of IT the connection to an external computer centre with a backup solution  for the core banking system provides a great degree of security,SECURITY
UmweltBank AG,Nevertheless there is a  certain risk that downtime incorrectly implemented functions or insufficient security measures could lead to damage,SECURITY
UmweltBank AG,In the past year a refinement in the method of measuring  risk was implemented in which the risk value is no longer aggregated across all estimates  but is simulated by the drawing of random loss scenarios Monte Carlo simulation,LOSS
UmweltBank AG,On the basis of its refinancing structure  the Bank does not identify any risk concen - trations in its procurement of funds,FUNDS
UmweltBank AG,Customer  deposits have a high level of granularity,DEPOSIT
UmweltBank AG,In the lending business compliance with the regulatory limits on large loans and the  additional internal limits on industries prevent risk concentrations,REGULATORY
UmweltBank AG,The maturity structure  of own deposits is monitored on a daily basis,DEPOSIT
